doi	title	publisher	publicationYear
10.1594/pangaea.924469	Planktonic Foraminifera assemblages from sediment core SAT-048A	PANGAEA	2020
10.16907/05a50450-767f-421d-9832-342b57c201af	Selection of representative datasets for data compression investigations	PSI	2020
10.26037/yareta:nhslc5mgrjeclgqwzuvri6lgkq	Velocity of climate change revisited: MATCHing spatial shifts into a continuous field	Université de Genève, Yareta	2020
10.26037/yareta:kpmscrogqbdhvjeuev2ydrzk7y	Normalized Difference Vegetation Index (NDVI) - Annual Mean - Switzerland	Université de Genève, Yareta	2020
10.15468/saszmb	Elgin Road 3 year observations	Atlas of Living Australia	2020
10.15468/7z2u5g	Panboola Wetlands Mammals Survey	Atlas of Living Australia	2020
10.15468/m8zqqy	Re-examination of the reef corals of Cocos (Keeling) Atoll, Charlie Veron	Australian Institute of Marine Science	2020
10.15468/bs0bdf	Jervois and Karinga Flora	Atlas of Living Australia	2020
10.15468/ro8bpv	ACT Bioblitz Moth Survey	Atlas of Living Australia	2020
10.15468/tiih5n	Climate Change Adaptation Research Program (CCARP) Database of Watering Requirements - Images	Office of Environment & Heritage	2020
10.15468/vv31t9	Martin Butterfield Mallacoota Observations	Atlas of Living Australia	2020
10.15468/lkjjt3	Wairambar Rainforest Species List	Atlas of Living Australia	2020
10.15468/gvrgkb	Quoll sightings register for Nth QLD	Atlas of Living Australia	2020
10.15468/dul9fo	Flora of Westgate Park - Photos from Lyn Allison	Atlas of Living Australia	2020
10.15468/elgwwi	The Living Murray Fish data	Murray-Darling Basin Authority	2020
10.15468/qscvrr	Images of Flora and Fauna of 290 Leppitt Rd, Upper Beaconsfield	Atlas of Living Australia	2020
10.15468/liglpo	Species at 290 Leppitt Road, Upper Beaconsfield	Atlas of Living Australia	2020
10.15468/lrxdte	Hermatypic Corals of Western Australia	Australian Institute of Marine Science	2020
10.15468/ov7nfr	Barrow Island Ants	Chevron Australia	2020
10.15468/2bg7zv	Panboola Wetlands Bird Surveys	Atlas of Living Australia	2020
10.15468/wva3lh	School of Ants	University of New England	2020
10.15468/1nwdvk	Scleractinia of Eastern Australia - AIMS Monograph Series - John (Charlie) Veron	Australian Institute of Marine Science	2020
10.15468/kinrrl	Records of the Australian National Botanic Gardens Seedbank	Australian National Botanic Gardens	2020
10.15468/zllujp	Swan Coastal Plain Survey	Western Australia, Department of Biodiversity, Conservation and Attractions	2020
10.15468/4cqg2v	NatureShare	Atlas of Living Australia	2020
10.5255/ukda-sn-8644-5	Understanding Society: COVID-19 Study, 2020	UK Data Service	2020
10.5255/ukda-sn-5050-20	English Longitudinal Study of Ageing: Waves 0-9, 1998-2019	UK Data Service	2020
10.5255/ukda-sn-8644-4	Understanding Society: COVID-19 Study, 2020	UK Data Service	2020
10.5255/ukda-sn-8682-1	Millennium Cohort Study: Seventh Survey, 2018	UK Data Service	2020
10.5255/ukda-sn-5340-10	National Travel Survey, 2002-2019	UK Data Service	2020
10.5255/ukda-sn-7553-9	National Travel Survey, 2002-2019: Special Licence Access	UK Data Service	2020
10.5255/ukda-sn-7215-12	Wealth and Assets Survey, Waves 1-5 and Rounds 5-6, 2006-2018	UK Data Service	2020
10.5255/ukda-sn-8666-1	Smart Energy Research Lab Observatory Data, 2019-2020: Secure Access	UK Data Service	2020
10.5255/ukda-sn-8663-1	Understanding Society: COVID-19 Study, 2020: Special Licence Access, Census 2011 Lower Layer Super Output Areas	UK Data Service	2020
10.5255/ukda-sn-8644-3	Understanding Society: COVID-19 Study, 2020	UK Data Service	2020
10.5255/ukda-sn-8658-1	COVID-19 Survey in Five National Longitudinal Cohort Studies: Millennium Cohort Study, Next Steps, 1970 British Cohort Study and 1958 National Child Development Study, 2020	UK Data Service	2020
10.5255/ukda-sn-8644-2	Understanding Society: COVID-19 Study, 2020	UK Data Service	2020
10.5255/ukda-sn-8378-2	Taking Part: the National Survey of Culture, Leisure and Sport, 2016-2017; Adult and Child Data	UK Data Service	2020
10.5255/ukda-sn-8644-1	Understanding Society: COVID-19 Study, 2020	UK Data Service	2020
10.5255/ukda-sn-7451-13	Annual Business Survey, 2008-2018: Secure Access	UK Data Service	2020
10.5255/ukda-sn-7363-8	European Working Conditions Survey Integrated Data File, 1991-2015	UK Data Service	2020
10.5255/ukda-sn-8631-1	Taking Part: the National Survey of Culture, Leisure and Sport, 2018-2019; Adult and Child Data	UK Data Service	2020
10.5255/ukda-sn-5828-12	Households Below Average Income, 1994/95-2018/19	UK Data Service	2020
10.5255/ukda-sn-6727-19	Quarterly Labour Force Survey, 1992-2019: Secure Access	UK Data Service	2020
10.5255/ukda-sn-6676-10	Understanding Society: Waves 1-9, 2009-2018 and Harmonised BHPS: Waves 1-18, 1991-2009: Secure Access	UK Data Service	2020
10.5255/ukda-sn-6614-13	Understanding Society: Waves 1-9, 2009-2018 and Harmonised BHPS: Waves 1-18, 1991-2009	UK Data Service	2020
10.5255/ukda-sn-8202-2	British Election Study, 2014-2023: Combined Internet Panel	UK Data Service	2020
10.5255/ukda-sn-7104-5	Next Steps: Sweeps 1-8, 2004-2016: Secure Access	UK Data Service	2020
10.5255/ukda-sn-7252-2	Crime Survey for England and Wales, 2011-2012	UK Data Service	2020
10.5255/ukda-sn-6627-2	British Crime Survey, 2009-2010	UK Data Service	2020
10.5255/ukda-sn-6937-1	British Crime Survey, 2010-2011	UK Data Service	2020
10.5255/ukda-sn-6367-1	British Crime Survey, 2008-2009	UK Data Service	2020
10.5255/ukda-sn-6066-1	British Crime Survey, 2007-2008	UK Data Service	2020
10.5255/ukda-sn-5755-1	British Crime Survey, 2006-2007	UK Data Service	2020
10.5255/ukda-sn-5543-1	British Crime Survey, 2005-2006	UK Data Service	2020
10.5255/ukda-sn-5324-1	British Crime Survey, 2003-2004	UK Data Service	2020
10.5255/ukda-sn-5347-1	British Crime Survey, 2004-2005	UK Data Service	2020
10.5255/ukda-sn-5059-1	British Crime Survey, 2002-2003	UK Data Service	2020
10.5255/ukda-sn-4787-1	British Crime Survey, 2001-2002	UK Data Service	2020
10.11582/2020.00023	Annual maximum daily precipitation for the Nordic-Baltic countries	NIRD RDA	2020
10.15472/staos7	Octocorals and antipatharians in the mesophotic rocky reefs of Colombian Pacific	Instituto de Investigaciones Marinas y Costeras - Invemar	2020
10.17612/36f2-8q45	North Sea Sandstone SEM Images	Digital Rocks Portal	2020
10.17612/4px8-6x12	Hexadecane and brine injected into Estaillades carbonate - steady-state experiment	Digital Rocks Portal	2020
10.17612/f4h1-w124	11 Sandstones: raw, filtered and segmented data	Digital Rocks Portal	2020
10.17612/3qz6-f710	Bentheimer Sandstone Two-Fluid Flow Simulation Resembling Special Core Analysis Protocol	Digital Rocks Portal	2020
10.17612/vztt-yx38	Unpaired super-resolution on micro-CT sandstone by using cycle-consistent generative adversarial network	Digital Rocks Portal	2020
10.17612/aky4-9a88	Leman Sandstone SEM Images	Digital Rocks Portal	2020
10.17612/8f3w-em15	Grayscale REV Analysis	Digital Rocks Portal	2020
10.17612/c13t-ah38	Belgian Fieldstone	Digital Rocks Portal	2020
10.17612/nhda-wz02	Doddington Sandstone	Digital Porous Media Portal	2020
10.17612/vamk-ta18	Capillary rise in vuggy porous media	Digital Rocks Portal	2020
10.17612/bvxs-bc79	Mudrock images from Nankai Trough	Digital Rocks Portal	2020
10.17612/p8fq-6y93	Bentheimer Sandstone for Analyzing Wetting Phenomena	Digital Rocks Portal	2020
10.17612/v09y-aw80	Carbonates: Porosity and permeability voxel to voxel	Digital Rocks Portal	2020
10.17612/kt0b-sz28	A large scale X-Ray micro-tomography dataset of steady-state multiphase flow	Digital Rocks Portal	2020
10.17612/hdp8-0149	Experimental 3D Velocity Field in Random Sphere Packing	Digital Rocks Portal	2020
10.15472/gwbyg8	Colección Oológica Cornelis Johannes Marinkelle CJM del Instituto de Investigación de Recursos Biológicos Alexander von Humboldt	Instituto de Investigación de Recursos Biológicos Alexander von Humboldt	2020
10.25919/5f688fcc97166	RV Investigator BOM Atmospheric Data Overview (2016 onwards)	CSIRO	2020
10.24381/cds.3cd8b812	Sea ice concentration from 1978 to present derived from satellite observations	ECMWF	2020
10.26143/ganil-2020-e775s	Lifetime measurements of excited states in 20O populated by direct nucleon transfer	GANIL, Large Heavy Ion National Accelerator, Caen, France	2020
10.15472/qxtu93	Hormigas (Hymenoptera: Formicidae) del Centro de Colecciones Biológicas de la Universidad del Magdalena	Universidad del Magdalena	2020
10.15472/mhq2sa	Colección Herpetológica-Museo de Historia Natural Unillanos	Universidad de los Llanos	2020
10.15472/8ahlak	Colección Ictiológica - Museo de Historia Natural Unillanos	Universidad de los Llanos	2020
10.15472/io48wl	Colección Ornitológica del Museo de Historia Natural de la Universidad de la Amazonia	Universidad de la Amazonia	2020
10.15472/ayvwnh	Colección de reptiles del Museo de Historia Natural de la Universidad de la Amazonia (UAM-R)	Universidad de la Amazonia	2020
10.15472/zpze4r	Colección de Entomología del Museo de Historia Natural de la Universidad de la Amazonia (UAM-E)	Universidad de la Amazonia	2020
10.15472/tevjuw	Colección de Anfibios del Museo de Historia Natural de la Universidad de la Amazonia (UAM-H)	Universidad de la Amazonia	2020
10.15472/tfhckv	Colección Ictiológica del Museo de Historia Natural de la Universidad de la Amazonia (UAM-P)	Universidad de la Amazonia	2020
10.16904/15	GCOS SWE data from 11 stations in Switzerland	EnviDat	2020
10.16904/slf.2	Snow and the water cycle in a changing climate	EnviDat	2020
10.15472/knkrwh	Colección de Mamíferos del Museo de Historia Natural C.J. Marinkelle	Universidad de los Andes	2020
10.5683/sp2/sjwlpk	Enquête longitudinale auprès des parents séparés et recomposés du Québec	Borealis	2020
10.26008/1912/bco-dmo.787093.1	Trichodesmium sample provenance from samples collected in North Atlantic surface waters, station BATS, and station ALOHA between 2000 and 2018	Biological and Chemical Oceanography Data Management Office (BCO-DMO)	2020
10.26008/1912/bco-dmo.808502.1	Small particulate Polonium 210 and Lead 210 measurements from the Western Arctic Ocean, which were sampled as part of the 2015 US GEOTRACES Cruise, HLY1502 (GN01), on USCGC Healy	Biological and Chemical Oceanography Data Management Office (BCO-DMO)	2020
10.26008/1912/bco-dmo.808151.1	Dissolved and large particulate Polonium 210 and Lead 210 measurements from the Western Arctic Ocean, which were sampled as part of the 2015 US GEOTRACES Cruise, HLY1502 (GN01), on USCGC Healy	Biological and Chemical Oceanography Data Management Office (BCO-DMO)	2020
10.26008/1912/bco-dmo.807340.1	Size-fractionated major and minor particle composition and concentration from the from the US GEOTRACES Arctic cruise (HLY1502) on USCGC Healy from August to October 2015	Biological and Chemical Oceanography Data Management Office (BCO-DMO)	2020
10.26008/1912/bco-dmo.806510.1	Nitrite Oxidoreductase targeted metaproteomics from R/V Kilo Moana cruise KM1128 and R/V Falkor cruise FK160115 in the Central Pacific Ocean in 2011 and 2016	Biological and Chemical Oceanography Data Management Office (BCO-DMO)	2020
10.26008/1912/bco-dmo.787078.1	Metaproteomes of Trichodesmium from samples collected in North Atlantic surface waters, station BATS, and station ALOHA between 2000 and 2018	Biological and Chemical Oceanography Data Management Office (BCO-DMO)	2020
10.26008/1912/bco-dmo.753837.1	Radium isotope measurements from CTD and underway water samples from the R/V Endeavor from 2018-05-06 to 2018-05-29	Biological and Chemical Oceanography Data Management Office (BCO-DMO)	2020
10.26008/1912/bco-dmo.787181.1	FASTA file of sequences in Trichodesmium field metaproteomes mapped to a Trichodesmium metagenome plus cyanoGEBA species genomes from samples collected in the Atlantic and Pacific Ocean between 2000 and 2018	Biological and Chemical Oceanography Data Management Office (BCO-DMO)	2020
10.26008/1912/bco-dmo.787168.1	Net tow metaproteoome of Trichodesmium species mapped to a Trichodesmium metagenome plus cyanoGEBA species genomes in units of normalized peptide spectral counts from samples collected in the Atlantic and Pacific Ocean between 2000 and 2018	Biological and Chemical Oceanography Data Management Office (BCO-DMO)	2020
10.26008/1912/bco-dmo.787147.1	Net tow metaproteome of Trichodesmium species mapped to a Trichodesmium metagenome plus cyanoGEBA species genomes in units of normalized protein spectral counts from samples collected in the Atlantic and Pacific Ocean between 2000 and 2018	Biological and Chemical Oceanography Data Management Office (BCO-DMO)	2020
10.26008/1912/bco-dmo.808261.1	P. verrucosa growth data used to parameterize growth-rate curve	Biological and Chemical Oceanography Data Management Office (BCO-DMO)	2020
10.26008/1912/bco-dmo.810182.1	Yearly census of Gulf Stream Warm Core Ring formation from 1980 to 2017	Biological and Chemical Oceanography Data Management Office (BCO-DMO)	2020
10.26008/1912/bco-dmo.717495.1	Measurements of polysaccharide hydrolase activities in large volume mesocosm incubations RV/Endeavor EN584, July 2016 (Patterns of activities project)	Biological and Chemical Oceanography Data Management Office (BCO-DMO)	2020
10.26008/1912/bco-dmo.811147.1	Prochlorococcus, Synechococcus and picoeukaryotic phytoplankton abundance climatology in the global ocean from quantitative niche models.	Biological and Chemical Oceanography Data Management Office (BCO-DMO)	2020
10.26008/1912/bco-dmo.793776.1	Prochlorococcus, Synechococcus, and picoeukaryotic phytoplankton yearly standard deviation from mean global abundance estimated for four CMIP5 climate scenarios using an ensemble of five circulation models	Biological and Chemical Oceanography Data Management Office (BCO-DMO)	2020
10.26008/1912/bco-dmo.793847.1	Prochlorococcus, Synechococcus, and picoeukaryotic phytoplankton for four future climatic scenarios and five Earth System Models (cell/ml) in a global 1x1 grid for the ocean surface (50m)	Biological and Chemical Oceanography Data Management Office (BCO-DMO)	2020
10.26008/1912/bco-dmo.793690.1	Prochlorococcus, Synechococcus, and picoeukaryotic phytoplankton yearly mean global abundance for four CMIP5 climate scenarios using an ensemble of five circulation models	Biological and Chemical Oceanography Data Management Office (BCO-DMO)	2020
10.26008/1912/bco-dmo.812918.1	Flume flow data from in-situ flume experiments to manipulate pCO2 on shallow tropical coral reef communities at UCB Gump Research Station Moorea, French Polynesia in May of 2018	Biological and Chemical Oceanography Data Management Office (BCO-DMO)	2020
10.26008/1912/bco-dmo.812927.1	Dissolved oxygen (DO) from in-situ flume experiments to manipulate pCO2 on shallow tropical coral reef communities at UCB Gump Research Station Moorea, French Polynesia in May of 2018	Biological and Chemical Oceanography Data Management Office (BCO-DMO)	2020
10.26008/1912/bco-dmo.812891.1	Alkalinity and salinity from in-situ flume experiments to manipulate pCO2 on shallow tropical coral reef communities at UCB Gump Research Station Moorea, French Polynesia in May of 2018	Biological and Chemical Oceanography Data Management Office (BCO-DMO)	2020
10.26008/1912/bco-dmo.812909.1	Biological data (net calcification and production) from in-situ flume experiments to manipulate pCO2 on shallow tropical coral reef communities at UCB Gump Research Station Moorea, French Polynesia in May of 2018	Biological and Chemical Oceanography Data Management Office (BCO-DMO)	2020
10.26008/1912/bco-dmo.812882.1	Partial pressure of carbon dioxide (pCO2) from in-situ flume experiments to manipulate pCO2 on shallow tropical coral reef communities at UCB Gump Research Station Moorea, French Polynesia in May of 2018	Biological and Chemical Oceanography Data Management Office (BCO-DMO)	2020
10.26008/1912/bco-dmo.812853.1	Photosynthetically active radiation (PAR) from in-situ flume experiments to manipulate pCO2 on shallow tropical coral reef communities at UCB Gump Research Station Moorea, French Polynesia in May of 2018	Biological and Chemical Oceanography Data Management Office (BCO-DMO)	2020
10.26008/1912/bco-dmo.812873.1	Temperature from in-situ flume experiments to manipulate pCO2 on shallow tropical coral reef communities at UCB Gump Research Station Moorea, French Polynesia in May of 2018	Biological and Chemical Oceanography Data Management Office (BCO-DMO)	2020
10.26008/1912/bco-dmo.812900.1	Dissolved oxygen (DO) flux from in-situ flume experiments to manipulate pCO2 on shallow tropical coral reef communities at UCB Gump Research Station Moorea, French Polynesia in May of 2018	Biological and Chemical Oceanography Data Management Office (BCO-DMO)	2020
10.26008/1912/bco-dmo.812864.1	pH from in-situ flume experiments to manipulate pCO2 on shallow tropical coral reef communities at UCB Gump Research Station Moorea, French Polynesia in May of 2018	Biological and Chemical Oceanography Data Management Office (BCO-DMO)	2020
10.26008/1912/bco-dmo.818610.1	Dissolved Cobalt and Labile Cobalt from Leg 2 (Hilo, HI to Papeete, French Polynesia) of the US GEOTRACES Pacific Meridional Transect (PMT) cruise (GP15, RR1815) on R/V Roger Revelle from October to November 2018	Biological and Chemical Oceanography Data Management Office (BCO-DMO)	2020
10.26008/1912/bco-dmo.805488.1	Mussels and associated organisms sampling information collected in the Pacific margin of Costa Rica.The collections were made aboard R/V Atlantis in 2017 and 2018 using DSV Alvin. The 2019 collections were made aboard R/V Falkor, using the ROV Subastian	Biological and Chemical Oceanography Data Management Office (BCO-DMO)	2020
10.26008/1912/bco-dmo.806673.1	Sampling information from community megafauna collected from different seep sites off the Costa Rica margin. Collections taken aboard R/V Atlantis in 2017 and 2018 using DSV Alvin. The 2019 collections were made aboard R/V Falkor, using the ROV Subastian.	Biological and Chemical Oceanography Data Management Office (BCO-DMO)	2020
10.26008/1912/bco-dmo.821539.1	Primary production from the San Pedro Ocean Time-series (SPOT) measured between 2014 to 2016	Biological and Chemical Oceanography Data Management Office (BCO-DMO)	2020
10.26008/1912/bco-dmo.774571.1	N2O concentrations from San Pedro Ocean Time-series (SPOT) measured between 2014 to 2016	Biological and Chemical Oceanography Data Management Office (BCO-DMO)	2020
10.26008/1912/bco-dmo.774602.2	Ammonia and urea-derived-N oxidation rates measured using 15N additions from San Pedro Ocean Time-series (SPOT) measured between 2014 to 2016	Biological and Chemical Oceanography Data Management Office (BCO-DMO)	2020
10.26008/1912/bco-dmo.564351.2	Weekly surface water samples from MICRO time series station at Newport Pier from 2012 to 2018	Biological and Chemical Oceanography Data Management Office (BCO-DMO)	2020
10.26008/1912/bco-dmo.816347.1	POM concentrations for carbon, nitrogen, phosphorus, and chemical oxygen from GO-SHIP Line P18 Legs 1 and 2 in 2016 and 2017	Biological and Chemical Oceanography Data Management Office (BCO-DMO)	2020
10.26008/1912/bco-dmo.733173.2	Counts of colonists collected from colonization plates at the East Pacific Rise (EPR) deep-sea vents (1998-2017)	Biological and Chemical Oceanography Data Management Office (BCO-DMO)	2020
10.26008/1912/bco-dmo.822239.1	Carbon and Nitrogen isotopes in an experimental benthic chamber, Maunalua, O’ahu, Hawai’i, 2015-2016	Biological and Chemical Oceanography Data Management Office (BCO-DMO)	2020
10.26008/1912/bco-dmo.822216.1	Benthic macroalgal and water column carbon uptake rates in an experimental chamber, Maunalua, O’ahu, Hawai’i, 2015-2016	Biological and Chemical Oceanography Data Management Office (BCO-DMO)	2020
10.26008/1912/bco-dmo.824623.1	Bacterial cell counts and Dissolved Organic Carbon (DOC) measurements from R/V Atlantis AT32, AT34, AT38, and AT39-06 in the western North Atlantic Ocean (35°N to 57°N; 45°W) in Nov. 2015, May 2016, Sep 2017, Mar/Apr 2018	Biological and Chemical Oceanography Data Management Office (BCO-DMO)	2020
10.26008/1912/bco-dmo.823408.1	Size fractionated Particulate Carbon Flux 100-500m measured by autonomous Carbon Flux Explorers deployed during the CCE-LTER process study (P1706) between June 2 and July 1, 2017 in the California Current Regime.	Biological and Chemical Oceanography Data Management Office (BCO-DMO)	2020
10.26008/1912/bco-dmo.779368.1	Continuous culture studies of possible climate change effects: Thalassiosira pseudonana CCMP1335 growth in nitrate-limited and nutrient-replete cultures	Biological and Chemical Oceanography Data Management Office (BCO-DMO)	2020
10.26008/1912/bco-dmo.746398.1	Experimental results of nitrate-limited or nitrate-replete continuous culture studies of Thalassiosira pseudonana at 5 temperatures with either high or low pCO2 and irradiance	Biological and Chemical Oceanography Data Management Office (BCO-DMO)	2020
10.26008/1912/bco-dmo.825076.1	Original transmitted-light imagery and processed attenuance images of sinking particles observed by autonomous Carbon Flux Explorers deployed 100-500m in the California Current Regime, during the CCE-LTER process study (P1706) between June 2 and July 1, 2	Biological and Chemical Oceanography Data Management Office (BCO-DMO)	2020
10.26008/1912/bco-dmo.825602.1	CTD profile data from Carbon Flux Explorers deployed 100-500m in the California Current Regime, during the CCE-LTER process study (P1706) between June 2 and July 1, 2017	Biological and Chemical Oceanography Data Management Office (BCO-DMO)	2020
10.26008/1912/bco-dmo.521553.1	B:Ca and Mg:Ca isotopes in foraminifera from sediment cores from R/V JOIDES Resolution JRES-198 in the Shatsky Rise, Pacific from 2001-2001 (OA_Paleocene-Eocene project)	Biological and Chemical Oceanography Data Management Office (BCO-DMO)	2020
10.26008/1912/bco-dmo.522939.1	Experimental seawater chemical properties for larval mussel shell study from SIO, UCSD from 2012-2013 (OA_Proxies project)	Biological and Chemical Oceanography Data Management Office (BCO-DMO)	2020
10.26008/1912/bco-dmo.521670.1	Larval mussel shell composition under high and low pH and O2 from SIO, UCSD from 2012 and 2013 (OA_Proxies project)	Biological and Chemical Oceanography Data Management Office (BCO-DMO)	2020
10.26008/1912/bco-dmo.821783.1	Oysters size and presence or absence of disease at intertidal and subtidal reefs in Apalachicola Bay and Ocholckonee Bays, FL, July-August 2016	Biological and Chemical Oceanography Data Management Office (BCO-DMO)	2020
10.26008/1912/bco-dmo.821071.1	Surveys of inhabitants on the intertidal and subtidal oyster reef in Apalachicola Bay and Ocholckonee Bay, FL, 2013-2019	Biological and Chemical Oceanography Data Management Office (BCO-DMO)	2020
10.26008/1912/bco-dmo.821061.1	Water quality data from surveys, experiments and the NERR data sonde, sub-tropical estuarine waters, subtidal and intertidal in Apalachicola Bay and Ocholckonee Bay, Florida, 2013-2019	Biological and Chemical Oceanography Data Management Office (BCO-DMO)	2020
10.26008/1912/bco-dmo.821081.1	Organism sizes on oyster reef quadrats from surveys in Apalachicola Bay and Ocholckonee Bay, FL, 2013-2019	Biological and Chemical Oceanography Data Management Office (BCO-DMO)	2020
10.26008/1912/bco-dmo.821771.1	Non-oyster species counts and sizes from caged and non-caged juvenile oyster experiment using two cohorts from Apalachicola Bay and Ocholckonee Bay stock	Biological and Chemical Oceanography Data Management Office (BCO-DMO)	2020
10.26008/1912/bco-dmo.786694.1	Single colony metaproteomes of Trichodesmium from samples collected in North Atlantic surface waters during the R/V Atlantis cruise AT39-05 in March of 2018	Biological and Chemical Oceanography Data Management Office (BCO-DMO)	2020
10.26008/1912/bco-dmo.821793.1	The status of juvenile oysters from a caged and non-caged recruitment experiments using two cohorts from Apalachicola Bay and Ocholckonee Bay stock, 2013-2016 and 2019	Biological and Chemical Oceanography Data Management Office (BCO-DMO)	2020
10.26008/1912/bco-dmo.774571.2	N2O concentrations from San Pedro Ocean Time-series (SPOT) measured between 2014 to 2016	Biological and Chemical Oceanography Data Management Office (BCO-DMO)	2020
10.26008/1912/bco-dmo.827298.1	Bulk soil and elemental properties of marsh and infilled pond soils collected in 2014-2015 within Plum Island Ecosystems LTER	Biological and Chemical Oceanography Data Management Office (BCO-DMO)	2020
10.26008/1912/bco-dmo.829797.1	Depth profile data from R/V Atlantic Explorer AE1319 in the NW Atlantic from Aug-Sept. 2013	Biological and Chemical Oceanography Data Management Office (BCO-DMO)	2020
10.26008/1912/bco-dmo.827587.1	Carbon and nitrogen stable isotopes of Hawaiian corals collected from August to November 2015	Biological and Chemical Oceanography Data Management Office (BCO-DMO)	2020
10.26008/1912/bco-dmo.833824.1	Biogeochemical properties of sediment cores from Barataria Basin, Louisiana, 2018 and 2019	Biological and Chemical Oceanography Data Management Office (BCO-DMO)	2020
10.26008/1912/bco-dmo.773297.1	Sediment hydrocarbon concentrations in Alvin pushcore samples from Guaymas Basin hydrothermal vents, RV/Atlantis cruise AT42-05, Nov. 2018	Biological and Chemical Oceanography Data Management Office (BCO-DMO)	2020
10.26008/1912/bco-dmo.773288.1	Porewater hydrocarbon concentrations in Alvin pushcore samples from Guaymas Basin hydrothermal vents, RV/Atlantis cruise AT42-05, Nov. 2018	Biological and Chemical Oceanography Data Management Office (BCO-DMO)	2020
10.18710/jwtjjb	Research Data Publishing at UiT The Arctic University of Norway	DataverseNO	2020
10.18710/2zg3ei	Replication Data for: Accounting for food web dynamics when assessing the impact of mesopredator control on declining prey populations	DataverseNO	2020
