doi	title	publisher	publicationYear
10.5061/dryad.5dv41ns4s	Dataset for collaborative prediction of web service quality based on user preferences and services	Dryad	2020
10.5061/dryad.280gb5mp0	Data from: Pushing Raman spectroscopy over the edge: purported signatures of organic molecules in fossil animals are instrumental artefacts	Dryad	2020
10.5061/dryad.stqjq2c27	Bacterial dispersal and drift drive microbiome diversity patterns within a population of feral hindgut fermenters	Dryad	2020
10.5061/dryad.x0k6djhh9	An endangered bird calls less when invasive birds are calling	Dryad	2020
10.5061/dryad.nvx0k6dqw	Dual GIP and GLP-1 receptor agonist tirzepatide improves beta-cell function and insulin sensitivity in type 2 diabetes	Dryad	2020
10.5061/dryad.jdfn2z391	Data from: Climate warming prolongs the time interval between leaf-out and flowering in temperate trees: effects of chilling, forcing and photoperiod	Dryad	2020
10.5061/dryad.3bk3j9khn	Resprouting grasses are associated with less frequent fire than seeders	Dryad	2020
10.5061/dryad.bvq83bk79	Genomic analyses of phenotypic differences between native and invasive populations of diffuse knapweed (Centaurea diffusa)	Dryad	2020
10.5061/dryad.15dv41nw6	Ecological data from: Combining botanical collections and ecological data to better describe plant community diversity	Dryad	2020
10.5061/dryad.9kd51c5fn	Locating large insects using automated VHF radio telemetry with a multi-antennae array	Dryad	2020
10.5061/dryad.sn02v6x2t	Population genomics reveals repeated signals of adaptive divergence in the Atlantic salmon of northeastern Europe	Dryad	2020
10.5061/dryad.dbrv15f0c	Comparing three screen-based sedentary behaviours’ effect upon adolescents’ participation in physical activity: The ESSENS study	Dryad	2020
10.5061/dryad.rn8pk0p84	Evaluating a trait-based approach to compare natural enemy and pest communities in agroforestry versus arable systems	Dryad	2020
10.5061/dryad.p8cz8w9ns	Mantel and partial Mantel test data and scripts of mimetic evolution of Papilio polytes in the Ryukyu Islands, Japan	Dryad	2020
10.5061/dryad.s4mw6m959	Queen pheromone modulates the expression of epigenetic modifier genes in the brain of honeybee workers	Dryad	2020
10.5061/dryad.63xsj3v17	Quantifying selection on standard metabolic rate and body mass in Drosophila melanogaster	Dryad	2020
10.6078/d1k70z	Dataset for: Fiber optic sensing of concrete cracking and rebar deformation using several types of cable	Dryad	2020
10.5061/dryad.0gb5mkm02	Level and spatial pattern of overstory retention impose tradeoffs for regenerating and retained trees	Dryad	2020
10.5061/dryad.4b8gthtb9	Data From: Conservation planning in an uncertain climate: identifying projects that remain valuable and feasible across future scenarios	Dryad	2020
10.5061/dryad.j3tx95xc3	Molecular dynamics trajectories for ionic conductors in: Paradigms of frustration in superionic solid electrolytes	Dryad	2020
10.6071/m3zq2r	Multi-scale drivers of soil resistance predict vulnerability of seasonally wet meadows to trampling by pack stock animals in the Sierra Nevada, USA	Dryad	2020
10.5061/dryad.zcrjdfn92	Sibship reconstruction with SNPs illuminates the scope of a cryptic invasion of Asian Swamp Eels (Monotperus albus) in Georgia, USA	Dryad	2020
10.5061/dryad.9p8cz8wf0	Data from: Manipulating plant community composition to steer efficient N-cycling in intensively managed grasslands	Dryad	2020
10.5061/dryad.31zcrjdjj	Exploring the inclusion of dental providers on interprofessional healthcare teams treating patients with chronic obstructive pulmonary disease: a rapid review	Dryad	2020
10.5061/dryad.76hdr7sv4	Limb work and joint work minimisation reveal an energetic benefit to the elbows-back, knees-forward limb design in parasagittal quadrupeds. Supplementary material including data, simulation code and simulation results	Dryad	2020
10.5061/dryad.mpg4f4qxf	Coastal Habitat Restoration Survey	Dryad	2020
10.5061/dryad.qz612jmd3	Numerical response of predators to large variations of grassland vole abundance and long-term community change	Dryad	2020
10.5061/dryad.4qrfj6q8c	Weather variation affects the dispersal of grasshoppers beyond their elevational ranges	Dryad	2020
10.5061/dryad.2547d7wpc	Middle Eocene terrestrial paleoweathering and climate evolution in the midlatitude Bohai Bay Basin of Eastern China	Dryad	2020
10.5061/dryad.rr4xgxd71	Code for: Threshold assessment, categorical perception, and the evolution of reliable signaling	Dryad	2020
10.5061/dryad.f4qrfj6tw	Large mammalian herbivores contribute to conspecific negative density dependence in a temperate forest	Dryad	2020
10.5061/dryad.905qfttjd	Inhibition of firefly luciferase activity by a HIF prolyl hydroxylase inhibitor	Dryad	2020
10.5061/dryad.79cnp5ht1	Data from: Functional diversity of decomposers modulates litter decomposition affected by plant invasion along a climate gradient	Dryad	2020
10.5061/dryad.np5hqbzr8	Back into the past: Resurveying random plots to track community changes in Italian coastal dunes	Dryad	2020
10.5061/dryad.83bk3j9q4	Interspecific social dominance networks reveal mechanisms promoting coexistence in sympatric charrs in Hokkaido, Japan	Dryad	2020
10.5061/dryad.5qfttdz3g	Nematodes carried by beetles and remaining in malt extract agar (MEA)	Dryad	2020
10.5061/dryad.ncjsxkssw	The response of the ozone layer to quadrupled CO2 concentrations: implications for climate	Dryad	2020
10.5061/dryad.rn8pk0p83	Data for: Early-life behavior predicts first-year survival in a long-distance avian migrant	Dryad	2020
10.5061/dryad.7d7wm37sx	Saproxylic fly diversity in a Costa Rican forest mosaic	Dryad	2020
10.5061/dryad.t76hdr7zw	Interfering with neighbouring communities: allelopathy astray in the tundra delays seedling development	Dryad	2020
10.5061/dryad.8cz8w9gnq	"Data for the paper ""Experimental evolution of post-ingestive nutritional compensation in response to a nutrient-poor diet"""	Dryad	2020
10.5061/dryad.tx95x69w9	"Data used in: ""Impacts of predator-mediated interactions along a climatic gradient on the population dynamics of an alpine bird"""	Dryad	2020
10.5061/dryad.2280gb5qj	Multi-city street-sidewalk imagery from pedestrian mobile cameras	Dryad	2020
10.5061/dryad.sbcc2fr4w	SARS-CoV-2 transmission and control in a hospital setting: an individual-based modelling study	Dryad	2020
10.5061/dryad.0zpc866wb	Dataset from: Positive indirect effects of top-predators on the survival and behaviour of juvenile fishes	Dryad	2020
10.5061/dryad.ncjsxkssv	Contrasting effects of Miocene and Anthropocene levels of atmospheric CO2 on silicon accumulation in a model grass	Dryad	2020
10.5061/dryad.bnzs7h48s	Sex‐specific effects of predation risk on parental care in a sexually dichromatic Neotropical songbird	Dryad	2020
10.5061/dryad.73n5tb2vx	High resolution lidar data of the Khumbu glacier	Dryad	2020
10.5061/dryad.gtht76hk2	Data from: Early maternal loss affects diurnal cortisol slopes in immature but not mature wild chimpanzees	Dryad	2020
10.5061/dryad.djh9w0vz5	Olfactory perception of herbivore‐induced plant volatiles elicits counter‐defenses in larvae of the tobacco cutworm	Dryad	2020
10.5061/dryad.msbcc2fww	Selection on individuals of introduced species starts before introduction	Dryad	2020
10.5061/dryad.k3j9kd55n	Up in the air: threats to Afromontane biodiversity from climate change and habitat loss revealed by genetic monitoring of the Ethiopian Highlands bat	Dryad	2020
10.5061/dryad.vx0k6djq8	An evaluation of inbreeding measures using a whole genome sequenced cattle pedigree	Dryad	2020
10.5061/dryad.jwstqjq7h	Long-term effects of antibiotic treatments on honeybee colony fitness – a modelling approach	Dryad	2020
10.5061/dryad.2bvq83bnx	Morning glory species co-occurrence is associated with asymmetrically decreased and cascading reproductive isolation	Dryad	2020
10.5061/dryad.q83bk3jgg	Cellular and whole‐organism effects of prolonged versus acute heat stress in a montane, desert lizard	Dryad	2020
10.5061/dryad.fqz612jr9	Influences of climatic and social environment on variable maternal allocation among offspring in Alpine marmots	Dryad	2020
10.5061/dryad.n02v6wwvv	Pigmentation Genes Show Evidence of Repeated Divergence and Multiple Bouts of Introgression in Setophaga Warblers	Dryad	2020
10.5061/dryad.34tmpg4ht	Phylogenomic data for hyperdiverse daisy tribes	Dryad	2020
10.5061/dryad.34tmpg4hs	Balancing risks of injury and disturbance to marine mammals when pile driving at offshore windfarms	Dryad	2020
10.5061/dryad.8pk0p2nkt	Microsatellite data of 14 Avicennia marina populations from Mozambique Channel area	Dryad	2020
10.5061/dryad.dv41ns1w8	Sex-specific sterility caused by extreme temperatures is likely to create cryptic changes to the operational sex ratio in Drosophila virilis	Dryad	2020
10.5061/dryad.4tmpg4f7z	Data from: Ecological and evolutionary responses of an arctic plant to variation in microclimate and soil	Dryad	2020
10.5061/dryad.cjsxksn4m	Allometry rather than abiotic drivers explains biomass allocation among leaves, stems and roots of Artemisia across a large environmental gradient in China	Dryad	2020
10.5061/dryad.sn02v6x2n	Post-fire vegetation succession in the Siberian subarctic tundra over 45 years	Dryad	2020
10.5061/dryad.6q573n5x8	The effect of interactive ozone chemistry on weak and strong stratospheric polar vortex events	Dryad	2020
10.5061/dryad.zw3r2286w	Susceptibility of fire-bellied toad (B. bombina and B. variegata) tadpoles to predation	Dryad	2020
10.6078/d1gd8s	Matlab applications for: A mechanical model to interpret distributed fiber optic strain measurement at displacement discontinuities	Dryad	2020
10.5061/dryad.7wm37pvrj	Extensive hybridization reveals multiple coloration genes underlying a complex plumage phenotype	Dryad	2020
10.5061/dryad.9cnp5hqgh	Experimental evidence for stabilising selection on virulence in a bacterial pathogen	Dryad	2020
10.5061/dryad.4mw6m9086	Genome-scale target capture of mitochondrial and nuclear environmental DNA from water samples	Dryad	2020
10.5061/dryad.r2280gbbn	Drought legacy affects microbial community trait distributions related to moisture along a savannah grassland precipitation gradient	Dryad	2020
10.5061/dryad.1rn8pk0s0	Towards a taxonomically unbiased EU Biodiversity Strategy for 2030	Dryad	2020
10.5061/dryad.wpzgmsbk8	Phylogeny and biogeography of Fagus (Fagaceae) based on 28 nuclear single/low‐copy loci	Dryad	2020
10.5061/dryad.5tb2rbp2x	Data from: Effects of maternal genotypic identity and genetic diversity of the red mangrove Rhizophora mangle on associated soil bacterial communities: a field-based experiment	Dryad	2020
10.25338/b85g98	Data from: Ectothermy and the macroecology of home range scaling in snakes	Dryad	2020
10.5061/dryad.zpc866t75	Thalamic encoding of lexical status is lateralized during reading aloud	Dryad	2020
10.5061/dryad.bcc2fqz9x	Genetic structuring in Atlantic haddock contrasts with current management regimes	Dryad	2020
10.5061/dryad.0k6djh9z1	Data from: Loss of sweet taste despite the conservation of sweet receptor genes in insectivorous bats	Dryad	2020
10.5061/dryad.hqbzkh1dr	Irisin directly stimulates osteoclastogenesis and bone resorption in vitro and in vivo: RNAseq dataset	Dryad	2020
10.5061/dryad.sf7m0cg4c	Competition as a demolition derby: Why tolerating competitors is more important than suppressing them	Dryad	2020
10.5061/dryad.tx95x69w6	Comprehensive phylogenomic analyses re-write the evolution of parasitism within cynipoid wasps	Dryad	2020
10.5061/dryad.zgmsbcc8v	Predicting reservoir hosts based on early SARS-CoV-2 samples and analyzing later world-wide pandemic	Dryad	2020
10.5061/dryad.wm37pvmkx	Kinship does not predict the structure of a shark social network	Dryad	2020
10.5061/dryad.nvx0k6dqt	Weak founder effects but significant spatial genetic imprint of recent contraction and expansion of European beech populations.	Dryad	2020
10.5061/dryad.31zcrjdjg	Data from: Numerical models for assessing the risk of leaflet thrombosis post-transcatheter aortic valve-in-valve implantation	Dryad	2020
10.5061/dryad.6djh9w108	ZETA benchmarking neuropixels data	Dryad	2020
10.5061/dryad.8gtht76n6	Data from: Whole-genome analyses provide no evidence for dog introgression in Fennoscandian wolf populations	Dryad	2020
10.5061/dryad.f7m0cfxtg	Sedimentation and overfishing drive changes in early succession and coral recruitment (Palau, Micronesia)	Dryad	2020
10.5061/dryad.3n5tb2rfk	Data from: Translocation of an arctic seashore plant reveals signs of maladaptation to altered climatic conditions	Dryad	2020
10.5061/dryad.8cz8w9gnp	Avian point-counts from Rhode Island and Connecticut used to test species distribution models	Dryad	2020
10.7272/q6cc0xxj	DNA scaffolds enable efficient and tunable functionalization of biomaterials for immune cell modulation	Dryad	2020
10.5061/dryad.j9kd51c9q	Increased signal diversity/complexity of spontaneous EEG, but not evoked EEG responses, in ketamine-induced psychedelic state in humans	Dryad	2020
10.5061/dryad.bcc2fqz9w	Locomotion and paleoclimate explain the re-evolution of quadrupedal body form in Brachymeles lizards	Dryad	2020
10.5061/dryad.zkh18938j	Data from: Integration of genomics and transcriptomics predicts diabetic retinopathy susceptibility genes	Dryad	2020
10.5061/dryad.djh9w0vz1	Data from: The value of time-series data for conservation planning	Dryad	2020
10.7941/d1hg9j	Automating the interpretation of PM2.5 time-resolved measurements using a data-driven approach	Dryad	2020
10.5061/dryad.xsj3tx9d5	Model output for: Attributing causes of future climate change in the California Current System with multi-model downscaling	Dryad	2020
10.7272/q6mw2fcp	Data for: Cytoprotection by a naturally occurring variant of ATP5G1 in Arctic ground squirrel neural progenitor cells	Dryad	2020
10.5061/dryad.zs7h44j6v	Contrasted histories of organelle and nuclear genomes underlying physiological diversification in a grass species	Dryad	2020
10.5061/dryad.sn02v6x2k	Winner effects and switching assessment strategies facilitate fast and frugal decisions in territorial contests	Dryad	2020
10.5061/dryad.fbg79cnss	Frugivory underpins the nitrogen cycle	Dryad	2020
10.5061/dryad.hqbzkh1dp	Fragmentation and translocation distort the genetic landscape of ungulates: red deer in the Netherlands	Dryad	2020
10.5061/dryad.mw6m905vj	Table S5: Occupancy change observations in bog species in the Black Forest (Germany) across all sites from 1972-2019	Dryad	2020
10.5061/dryad.fttdz08r3	Indirect parental effects on offspring fitness by egg-derived fluids in an external fertiliser	Dryad	2020
10.5061/dryad.vdncjsxs9	Data: Using environmental DNA and occupancy modeling to estimate rangewide metapopulation dynamics	Dryad	2020
10.5061/dryad.nk98sf7s0	Olive ridley blood volume by nesting strategy	Dryad	2020
10.5061/dryad.7m0cfxpsb	Robustness of a meta‐network to alternative habitat loss scenarios	Dryad	2020
10.25338/b8t92s	Recent bark beetle outbreaks influence wildfire severity in mixed-conifer forests of the Sierra Nevada, California, USA	Dryad	2020
10.5061/dryad.jsxksn07j	Negative trait-based association between abundance of nitrogen fixing trees and long-term tropical forest biomass accumulation	Dryad	2020
10.5061/dryad.0k6djh9xx	Using ecological context to interpret spatiotemporal variation in natural selection	Dryad	2020
10.5061/dryad.wm37pvmkw	Forest inventory data from Finland and Sweden for: Demographic performance of European tree species at their hot and cold climatic edges, plus ancillary climate data	Dryad	2020
10.5061/dryad.r4xgxd29v	Data from: Regime shifts in an Early Triassic subtropical ecosystem	Dryad	2020
10.5061/dryad.nzs7h44q3	Detrimental impacts of climate change may be exacerbated by density dependent population regulation in blue mussels	Dryad	2020
10.5061/dryad.n8pk0p2t7	Fitness costs of parasites explain multiple life history tradeoffs in a wild mammal	Dryad	2020
10.5061/dryad.0cfxpnw0d	Data from: Corrigendum to: Deep learning improves taphonomic resolution: high accuracy in differentiating tooth marks made by lions and jaguars	Dryad	2020
10.5061/dryad.fj6q573sj	Gene expression dynamics during rapid organismal diversification of African cichlid fishes	Dryad	2020
10.5061/dryad.qz612jmd0	Long-term cloud forest response to climate warming revealed by insect speciation history	Dryad	2020
10.5061/dryad.6djh9w105	Biodiversity and Forest structure one year following the 2016 Fort McMurray (Alberta) fire event	Dryad	2020
10.5061/dryad.ns1rn8pqw	The Rhododendron genome and chromosomal organization provide insight into shared whole-genome duplications across the heath family (Ericaceae)	Dryad	2020
10.5061/dryad.xpnvx0kd5	Landscape heterogeneity shapes bird phylogenetic responses at forest-matrix interfaces in Atlantic Forest, Brazil	Dryad	2020
10.5061/dryad.x95x69pgf	Data from: The influence of climate variability on demographic rates of avian Afro-palearctic migrants	Dryad	2020
10.5061/dryad.tqjq2bvxc	Magnitude and predictability of pH fluctuations shape plastic responses to ocean acidification	Dryad	2020
10.5061/dryad.xsj3tx9d4	MGMT promoter methylation and IDH mutation detected in 301 patients with GBM	Dryad	2020
10.5061/dryad.w0vt4b8pg	Size-selective mortality induces evolutionary changes in group risk-taking behavior and the circadian system in a fish	Dryad	2020
10.5061/dryad.80gb5mkpk	Dataset: Tropical bats counter heat by combining torpor with adaptive hyperthermia	Dryad	2020
10.5061/dryad.vt4b8gtqb	Cohesin depleted cells rebuild functional nuclear compartments after endomitosis	Dryad	2020
10.5061/dryad.j3tx95xbx	Data from: Social selectivity in aging wild chimpanzees	Dryad	2020
10.5061/dryad.djh9w0vxz	Archaeological mitogenomes illuminate the historical ecology of sea otters (Enhydra lutris) and the viability of reintroduction	Dryad	2020
10.5061/dryad.4j0zpc891	Adaptation to elevation but limited local adaptation in an amphibian	Dryad	2020
10.25349/d9c32r	Data from: A global network of marine protected areas for food	Dryad	2020
10.5061/dryad.98sf7m0h4	Glucose transporter expression and regulation following a fast in the ruby-throated hummingbird, Archilochus colubris	Dryad	2020
10.5061/dryad.73n5tb2vw	Data from: An analysis of travel reports of the Finnish botanical expeditions to Russian Lapland (Murmansk Region and Northern Karelia) in 1861 and 1863	Dryad	2020
10.5061/dryad.crjdfn32t	Artificial nightlight alters the predator-prey dynamics of an apex carnivore	Dryad	2020
10.5061/dryad.q573n5th0	The interplay of color and bioacoustic traits in the differentiation of a Southeast Asian songbird complex	Dryad	2020
10.5061/dryad.cvdncjt2t	Carbohydrate depletion in roots impedes phosphorus nutrition of forest trees	Dryad	2020
10.5061/dryad.pc866t1mh	The evolution of insect Metallothioneins	Dryad	2020
10.5061/dryad.x95x69pgc	Pathogenic Leptospira isolated from rodents in New Orleans, Louisiana USA, and associated site information	Dryad	2020
10.5061/dryad.vmcvdncr5	Sex-specific intergenerational plasticity I: maternal and paternal effects on sons and daughters	Dryad	2020
10.5061/dryad.0p2ngf1zn	Data for: Microclimate structures communities, predation and herbivory in the High Arctic	Dryad	2020
10.5061/dryad.bnzs7h48k	Data from: First records of complete annual cycles in water rails Rallus aquaticus show evidence of itinerant breeding and a complex migration system	Dryad	2020
10.5061/dryad.hqbzkh1dm	Effects of back‐mounted biologgers on condition, diving and flight performance in a breeding seabird	Dryad	2020
10.5061/dryad.vmcvdncr3	Data from: Differential effects of fertilisers on pollination and parasitoid interaction networks	Dryad	2020
10.5061/dryad.bvq83bk6v	Data from: Allometric scaling of eDNA production in stream-dwelling brook trout (Salvelinus fontinalis) inferred from population size structure	Dryad	2020
10.5061/dryad.fttdz08r1	Data from: Disentangling direct and indirect determinants of the duration of maternal care in brown bears: environmental context matters	Dryad	2020
10.5061/dryad.fn2z34ts3	Supplementary Information for: A cautionary note on the use of genotype callers in phylogenomics	Dryad	2020
10.5061/dryad.ffbg79csj	Data for the effect of optic flow cues on honeybee flight control in wind	Dryad	2020
10.5061/dryad.vmcvdncr2	AFLP and geometric morphometrics for Littorina fabalis	Dryad	2020
10.5061/dryad.g79cnp5ns	Multiscale drivers of carabid beetle (Coleoptera: Carabidae) assemblages in small European woodlands	Dryad	2020
10.5061/dryad.3ffbg79gj	Data from: Lining the nest with more feathers increases offspring recruitment probability: Selection on an extended phenotype in the blue tit	Dryad	2020
10.5061/dryad.z612jm69k	Data from: Spontaneous forest regrowth in South-West Europe: consequences for nature’s contributions to people	Dryad	2020
10.5061/dryad.ffbg79csh	Preparatory immunity: Seasonality of mucosal skin defenses and Batrachochytrium infections in Southern leopard frogs	Dryad	2020
10.5061/dryad.kh189323z	Data on zooplankton species and lake environments from 29 lakes in southern Ontario, Canada	Dryad	2020
10.5061/dryad.fqz612jr5	Data from: A unique hybodontiform skeleton provides novel insights into Mesozoic chondrichthyan life	Dryad	2020
10.5061/dryad.msbcc2fwq	Support for a relationship between demography and modeled habitat suitability is scale dependent for the Purple Martin, Progne subis	Dryad	2020
10.5061/dryad.8gtht76n0	A novel method for using RNA-seq data to identify imprinted genes in social Hymenoptera with multiply mated queens	Dryad	2020
10.5061/dryad.s1rn8pk5w	Data from: Effects of ambient temperatures on evolutionary potential of reproductive timing in boreal passerines	Dryad	2020
10.7941/d1t050	Indoor air quality in new and renovated low‐income apartments with mechanical ventilation and natural gas cooking in California	Dryad	2020
10.5061/dryad.pg4f4qrmw	Data for Body mass-related changes in mammal community assembly patterns during the late Quaternary of North America	Dryad	2020
10.5061/dryad.tmpg4f4wx	Biogeographic parallels in thermal tolerance and gene expression variation under temperature stress in a widespread bumble bee	Dryad	2020
10.5061/dryad.crjdfn32s	Coregonus spp. opsin amplicon sequence alignments	Dryad	2020
10.5061/dryad.g4f4qrfp1	Habitat use of co-occurring burying beetles (genus Nicrophorus) in southeastern Ontario, Canada	Dryad	2020
10.5061/dryad.8pk0p2nkq	The clinical impact of high-profile animal-based research reported in the UK national press: a detailed discussion of articles from 1995, and full search results from the Nexis database	Dryad	2020
10.5061/dryad.jq2bvq87d	Dataset for METAPOPGEN 2.0: a multi-locus genetic simulator to model populations of large size	Dryad	2020
10.5061/dryad.h18931zj8	PCB126 exposure revealed alterations in m6A RNA modifications in transcripts associated with AHR activation	Dryad	2020
10.5061/dryad.g79cnp5nr	Datasets relating (i) A wetland fish multimetric index to variation in agricultural stress among Laurentian Great Lakes coastal wetlands, (ii) Cyanobacteria biomass to total phosphorus concentrations among Canadian lakes	Dryad	2020
10.5061/dryad.jdfn2z38x	Data from: Paleotemperatures and recurrent habitat shifts drive diversification of treefrogs across distinct biodiversity hotspots in sub-Amazonian South America	Dryad	2020
10.5061/dryad.cvdncjt2r	Data from: Four myriapod relatives – but who are sisters? No end to debates on relationships among the four major myriapod subgroups	Dryad	2020
10.5061/dryad.8cz8w9gnj	Entorhinal-retrosplenial circuits for allocentric-egocentric transformation of boundary coding	Dryad	2020
10.5061/dryad.bzkh1896w	Data from: Nasal compartmentalization in Kogiidae (Cetacea, Physeteroidea): Insights from a new late Miocene dwarf sperm whale from the Pisco Formation	Dryad	2020
10.5061/dryad.qrfj6q5db	Global biogeography of fungal and bacterial biomass carbon in topsoil	Dryad	2020
10.5061/dryad.4tmpg4f7s	Young frigatebirds learn how to compensate for wind-drift	Dryad	2020
10.5061/dryad.2rbnzs7m4	Quantitative analysis of optical coherence tomography for neovascular age-related macular degeneration using deep learning	Dryad	2020
10.5061/dryad.g4f4qrfnz	Grazing and climate change have site-dependent interactive effects on vegetation in Asian montane rangelands	Dryad	2020
10.5061/dryad.2280gb5qc	Individual variability and versatility in an eco-evolutionary model of avian migration	Dryad	2020
10.6076/d1159c	Closed-loop control of k-space sampling via physiologic feedback for cine MRI	Dryad	2020
10.5061/dryad.34tmpg4hk	Wind creates crown shyness, asymmetry and orientation in a tropical montane oak forest	Dryad	2020
10.5061/dryad.j3tx95xbv	Below- and aboveground traits explain local abundance, and regional, continental and global occurrence frequencies of grassland plants	Dryad	2020
10.5061/dryad.g4f4qrfnx	Tracking sickness effects on social encounters via continuous proximity-sensing in wild vampire bats	Dryad	2020
10.5061/dryad.bk3j9kd8t	Temperature-dependent competitive outcomes between the fruit flies Drosophila santomea and D. yakuba	Dryad	2020
10.5061/dryad.tdz08kpxt	Dsuite - fast D-statistics and related admixture evidence from VCF files	Dryad	2020
10.6078/d1811g	Supporting data: 3D projection electrophoresis for single-cell immunoblotting (Part 3)	Dryad	2020
10.5061/dryad.r4xgxd29r	Rainfall pulses mediate long-term plant community compositional dynamics in a semi-arid rangeland	Dryad	2020
10.5061/dryad.9s4mw6mdq	Teaching and learning in ecology: a horizon scan of emerging challenges and solutions	Dryad	2020
10.5061/dryad.9cnp5hqgb	Short-term heritable variation overwhelms two hundred generations of mutational variance for metabolic traits in Caenorhabditis elegans	Dryad	2020
