doi	title	publisher	publicationYear
10.26008/1912/bco-dmo.930347.1	Concentrations of dissolved thorium and protactinium isotopes (232Th, 230Th, 231Pa) in seawater collected during the Indian GEOTRACES Transect (SK312; GI02) in April-May 2014	Biological and Chemical Oceanography Data Management Office (BCO-DMO)	2024
10.26008/1912/bco-dmo.931248.1	Concentrations of dissolved thorium and protactinium isotopes (232Th, 230Th, 231Pa) in seawater collected during the Indian GEOTRACES Transect (SK324; GI05) in September-October 2015	Biological and Chemical Oceanography Data Management Office (BCO-DMO)	2024
10.26008/1912/bco-dmo.904417.1	Depth profiles of pore water constituents from sediment cores collected on the Louisiana Shelf of the Northern Gulf of Mexico during November 2020 on R/V Savannah cruise SAV-20-07	Biological and Chemical Oceanography Data Management Office (BCO-DMO)	2024
10.26008/1912/bco-dmo.904782.1	Electrochemical data from sediment cores collected on the Louisiana Shelf of the Northern Gulf of Mexico during November 2020 on R/V Savannah cruise SAV-20-07	Biological and Chemical Oceanography Data Management Office (BCO-DMO)	2024
10.26008/1912/bco-dmo.928039.1	Bacterial transcriptional response to picoeukaryote Micromonas commoda	Biological and Chemical Oceanography Data Management Office (BCO-DMO)	2024
10.26008/1912/bco-dmo.931959.1	Dissolved trace elements in profiles and surface waters collected during the Chinese GEOTRACES cruise (GP09) in the tropical northwest Pacific Ocean from April to June 2019	Biological and Chemical Oceanography Data Management Office (BCO-DMO)	2024
10.26008/1912/bco-dmo.914459.1	Gene expression profiles for Neocalanus flemingeri pre adults (CV) exposed to four different experimental food conditions collected from the M/V Dora in the Gulf of Alaska at station GAK1 from April 2019	Biological and Chemical Oceanography Data Management Office (BCO-DMO)	2024
10.26008/1912/bco-dmo.908689.1	Annotated de novo transcriptomes generated from six co-occurring species of calanoid copepods from the R/V Tiglax TXF18, TXS19, TXF15, TXF17 in the Gulf of Alaska from 2015-2019	Biological and Chemical Oceanography Data Management Office (BCO-DMO)	2024
10.26008/1912/bco-dmo.835589.4	Dissolved concentrations of Ba, Cd, Cu, Ga, Mn, Ni, and Pb from Leg 1 (Seattle, WA to Hilo, HI) of the US GEOTRACES Pacific Meridional Transect (PMT) cruise (GP15, RR1814) on R/V Roger Revelle from September to October 2018	Biological and Chemical Oceanography Data Management Office (BCO-DMO)	2024
10.26008/1912/bco-dmo.932161.1	Dissolved concentrations of rare earth elements (including Y) from Leg 1 of the US GEOTRACES Pacific Meridional Transect (PMT) cruise (GP15, RR1814) on R/V Roger Revelle from September to October 2018	Biological and Chemical Oceanography Data Management Office (BCO-DMO)	2024
10.26008/1912/bco-dmo.931936.1	Metagenomic Time Series of Winam Gulf, Lake Victoria from 2022-2023 (ASI Lake Victoria project)	Biological and Chemical Oceanography Data Management Office (BCO-DMO)	2024
10.26008/1912/bco-dmo.836121.3	Dissolved concentrations of Ba, Cd, Cu, Ga, Mn, Ni, and Pb from Leg 2 (Hilo, HI to Papeete, French Polynesia) of the US GEOTRACES Pacific Meridional Transect (PMT) cruise (GP15, RR1815) on R/V Roger Revelle from Oct-Nov 2018	Biological and Chemical Oceanography Data Management Office (BCO-DMO)	2024
10.26008/1912/bco-dmo.932559.1	Dissolved concentrations of rare earth elements (including Y) from Leg 2 (Hilo, HI to Papeete, French Polynesia) of the US GEOTRACES Pacific Meridional Transect (PMT) cruise (GP15, RR1815) on R/V Roger Revelle from October to November 2018	Biological and Chemical Oceanography Data Management Office (BCO-DMO)	2024
10.26008/1912/bco-dmo.865757.1	ZooSCAN images of zooplankton collected along physical gradients during OAPS MOCNESS tows during R/V Oceanus cruise OC473 in the northwest Atlantic in 2011 and R/V New Horizon cruise NH1208 in the northeast Pacific in 2012 and imaged in 2021-2022	Biological and Chemical Oceanography Data Management Office (BCO-DMO)	2024
10.26008/1912/bco-dmo.881861.4	Zooplankton biomass measured from net tows conducted during ongoing monthly cruises, from April 1994 to December 2023, at the Bermuda Atlantic Time-series Study (BATS) site in the Sargasso Sea	Biological and Chemical Oceanography Data Management Office (BCO-DMO)	2024
10.26008/1912/bco-dmo.931469.1	Sanger Sequencing Analysis of Potexvirus PCR Products (Potex-5 and Potex-2RC) collected during West Florida Coastal Surveys of Seagrass from Feb 2022 to Oct 2023	Biological and Chemical Oceanography Data Management Office (BCO-DMO)	2024
10.26008/1912/bco-dmo.928980.1	Chlorphyll a and pheophytin from two cruises performed as part of the STING project from R/V Atlantic Explorer AE2305 (Sting I cruise) and R/V Endeavor EN704 (Sting II cruise) in the Gulf of Mexico near Florida from February to July 2023	Biological and Chemical Oceanography Data Management Office (BCO-DMO)	2024
10.26008/1912/bco-dmo.933707.1	Nitrite (NO2-) isotopes and concentrations from the U.S. GEOTRACES EPZT cruise (GP16, TN303) on R/V Thomas G. Thompson in the tropical Pacific from October to December 2013	Biological and Chemical Oceanography Data Management Office (BCO-DMO)	2024
10.26008/1912/bco-dmo.933645.1	Nitrous oxide (N2O) isotopes and concentrations from the U.S. GEOTRACES EPZT cruise (GP16, TN303) on R/V Thomas G. Thompson in the tropical Pacific from October to December 2013	Biological and Chemical Oceanography Data Management Office (BCO-DMO)	2024
10.26008/1912/bco-dmo.765141.4	Continous Plankton Recorder phytoplankton and zooplankton occurrence and count data from The CPR Survey in the Western North Atlantic Ocean from 1958 to 2021	Biological and Chemical Oceanography Data Management Office (BCO-DMO)	2024
10.26008/1912/bco-dmo.930111.1	Major inorganic ions from seawater collected near the BATS station during R/V Atlantic Explorer cruises AE2113 (July 2021) and AE2303 (January 2023)	Biological and Chemical Oceanography Data Management Office (BCO-DMO)	2024
10.26008/1912/bco-dmo.931318.1	Major inorganic ions in Primary Marine Aerosols (PMA) generated from seawater collected near the BATS station during R/V Atlantic Explorer cruises AE2113 (July 2021) and AE2303 (January 2023)	Biological and Chemical Oceanography Data Management Office (BCO-DMO)	2024
10.26008/1912/bco-dmo.929873.1	Chlorophyll-a concentrations in seawater collected near the BATS station during R/V Atlantic Explorer cruises AE2113 (July 2021) and AE2303 (January 2023)	Biological and Chemical Oceanography Data Management Office (BCO-DMO)	2024
10.26008/1912/bco-dmo.920078.2	Dissolved thorium and protactinium isotopes (232Th, 230Th, 231Pa) in seawater from Leg 2 (Hilo, HI to Papeete, French Polynesia) of the US GEOTRACES Pacific Meridional Transect (PMT) cruise (GP15, RR1815) on R/V Roger Revelle from Oct-Nov 2018	Biological and Chemical Oceanography Data Management Office (BCO-DMO)	2024
10.26008/1912/bco-dmo.932707.1	Dissolved total (dCo) and labile Co (lCo) measurements from the US GEOTRACES GP17-OCE cruise on R/V Roger Revelle (RR2214) in the South Pacific and Southern Oceans from December 2022 to January 2023	Biological and Chemical Oceanography Data Management Office (BCO-DMO)	2024
10.26008/1912/bco-dmo.926911.1	Thermal tolerance (ED50) data used to compare previously published regional (Florida Reef Tract, Coral Sea, Red Sea) coral thermal tolerance with Heron Island, Great Barrier Reef values measured in 2022	Biological and Chemical Oceanography Data Management Office (BCO-DMO)	2024
10.26008/1912/bco-dmo.926905.1	Temperature data from short-term heat stress assays performed with with corals collected from sites around Heron Island, southern Great Barrier Reef  in Sept and Oct of 2022	Biological and Chemical Oceanography Data Management Office (BCO-DMO)	2024
10.26008/1912/bco-dmo.926887.1	Photochemical yield and color score data from short-term heat stress assays performed with with corals collected from sites around Heron Island, southern Great Barrier Reef  in Sept and Oct of 2022	Biological and Chemical Oceanography Data Management Office (BCO-DMO)	2024
10.26008/1912/bco-dmo.931516.1	Ammonium (NH4) and Nitrite (NO2) concentrations from R/V Roger Revelle cruise RR2311 in the Eastern Tropical South Pacific from November to December 2023	Biological and Chemical Oceanography Data Management Office (BCO-DMO)	2024
10.26008/1912/bco-dmo.933334.1	Summary data from the Heatwaves and Coral-Recovery Database (HeatCRD) covering global coral reef sites from 1977-2020	Biological and Chemical Oceanography Data Management Office (BCO-DMO)	2024
10.26008/1912/bco-dmo.934896.1	Model code and output for a comparison of methods for meta-analysis investigating covariance between genetic and environmental (CovGE) effects in phenotypic results	Biological and Chemical Oceanography Data Management Office (BCO-DMO)	2024
10.26008/1912/bco-dmo.930084.1	Flow cytometry, 16S rRNA gene amplicons, chlorophyll a, and surface seawater measurements  taken between August 2017 to June 2019 Kāneʻohe Bay, Oʻahu, Hawaiʻi	Biological and Chemical Oceanography Data Management Office (BCO-DMO)	2024
10.26008/1912/bco-dmo.930163.1	Biological oceanographic measurements, 16S rRNA gene amplicons and metagenomes from surface seawater taken from August 2017 to June 2021 at sites within and adjacent to Kāneʻohe Bay, Oʻahu, Hawaiʻi	Biological and Chemical Oceanography Data Management Office (BCO-DMO)	2024
10.26008/1912/bco-dmo.765141.5	Continous Plankton Recorder phytoplankton and zooplankton occurrence and count data from The CPR Survey in the Western North Atlantic Ocean from 1958 to 2021	Biological and Chemical Oceanography Data Management Office (BCO-DMO)	2024
10.26008/1912/bco-dmo.933743.1	Bottle-calibrated dissolved oxygen (DO) profiles from US Overturning in the Subpolar North Atlantic Program (OSNAP) cruises in 2020 and 2022 (AR45 and AR69-03)	Biological and Chemical Oceanography Data Management Office (BCO-DMO)	2024
10.26008/1912/bco-dmo.934025.1	Discrete sample measurements of dissolved oxygen, dissolved inorganic carbon, and total alkalinity from US Overturning in the Subpolar North Atlantic Program (OSNAP) cruises in 2020 and 2022 (AR45 and AR69-03)	Biological and Chemical Oceanography Data Management Office (BCO-DMO)	2024
10.26008/1912/bco-dmo.923065.1	Dissolved organic Fe-binding ligand data from the FRidge (GA13) expedition on RRS James Cook (cruise JC156) from December 2017 to February 2018	Biological and Chemical Oceanography Data Management Office (BCO-DMO)	2024
10.26008/1912/bco-dmo.936369.1	Composition and concentration of individual biomarkers collected by particle interceptor traps in the Amazon River plume during R/V Knorr cruise KN197-08 in 2010 and R/V Melville cruise MV1110 in 2011	Biological and Chemical Oceanography Data Management Office (BCO-DMO)	2024
10.26008/1912/bco-dmo.930162.1	MOCNESS net data from R/V Sally Ride cruise SR2114 in the Eastern Tropical Pacific from December 2021 to January 2022	Biological and Chemical Oceanography Data Management Office (BCO-DMO)	2024
10.26008/1912/bco-dmo.936596.1	Composition and concentration of individual biomarkers in particulate organic carbon collected during two cruises to the Amazon River plume during R/V Knorr cruise KN197-08 in 2010 and R/V Melville cruise MV1110 in 2011	Biological and Chemical Oceanography Data Management Office (BCO-DMO)	2024
10.26008/1912/bco-dmo.934800.1	Bioproject accession information on tag-sequence data for Pisaster ochraceus samples collected from Bodega Bay, CA, in July 2019	Biological and Chemical Oceanography Data Management Office (BCO-DMO)	2024
10.26008/1912/bco-dmo.934772.1	Whole genome sequence data for Pisaster ochranceus samples collected from the Pacific coast of North America from July 2004 to May 2018	Biological and Chemical Oceanography Data Management Office (BCO-DMO)	2024
10.26008/1912/bco-dmo.936073.1	Alkalinity and dissolved inorganic carbon (DIC) from sea water samples collected at coral reefs from equatorial central Pacific in 1973, 2012, 2015, and 2018	Biological and Chemical Oceanography Data Management Office (BCO-DMO)	2024
10.26008/1912/bco-dmo.933292.1	Average nitrate d15N values from the upper 1000 meters of the water column at four stations sampled in the Eastern Tropical North Pacific on R/V Sally Ride cruise SR2113 in December 2021	Biological and Chemical Oceanography Data Management Office (BCO-DMO)	2024
10.26008/1912/bco-dmo.936824.1	Dissolved iron concentrations and stable isotope ratios from water column samples collected during four Bermuda Atlantic Iron Time-series (BAIT) cruises EN631, AE1909, AE1921, AE1930 in the Western Subtropical North Atlantic Gyre in 2019	Biological and Chemical Oceanography Data Management Office (BCO-DMO)	2024
10.26008/1912/bco-dmo.919969.1	Experimental data (coral diet and tissue d15N) from a culture experiment with scleractinian cold-water coral Balanophyllia elegans collected at Friday Harbor, WA from experiments conducted between 2019 and 2020	Biological and Chemical Oceanography Data Management Office (BCO-DMO)	2024
10.26008/1912/bco-dmo.937008.1	Stable isotopic composition of total, deionized-water-soluble, and dilute-acetic-acid-soluble aerosol iron from analysis of composite aerosol samples collected at Tudor Hill, Bermuda between Nov 2018 and March 2020	Biological and Chemical Oceanography Data Management Office (BCO-DMO)	2024
10.26008/1912/bco-dmo.919958.1	Nitrogen isotope ratio data for coral tissue and skeleton samples of the scleractinian cold-water coral Balanophyllia elegans collected at Friday Harbor, WA from experiments conducted between 2019 and 2021	Biological and Chemical Oceanography Data Management Office (BCO-DMO)	2024
10.26008/1912/bco-dmo.919993.1	Experimental data (d15N and d13C) from a starvation experiment with scleractinian cold-water coral Balanophyllia elegans collected at Friday Harbor, WA with experiments conducted between 2020 and 2022	Biological and Chemical Oceanography Data Management Office (BCO-DMO)	2024
10.26008/1912/bco-dmo.919985.1	Particulate data collected near Friday Harbor, WA between 2020 and 2021 as part of a study of cold-water coral Balanophyllia elegans diet and trophic position	Biological and Chemical Oceanography Data Management Office (BCO-DMO)	2024
10.26008/1912/bco-dmo.920001.1	CTD data from casts at Friday Harbor, WA in August of 2021 as part of a study of cold-water coral Balanophyllia elegans diet and trophic position	Biological and Chemical Oceanography Data Management Office (BCO-DMO)	2024
10.26008/1912/bco-dmo.881459.1	Total water column Thorium-234 measurements collected during the 2012-2013 Palmer Field Season (WAP Carbon export project)	Biological and Chemical Oceanography Data Management Office (BCO-DMO)	2024
10.26008/1912/bco-dmo.917255.4	Discrete bottle samples collected during BATS Validation (BVAL) cruises from April 1991 through June 2023	Biological and Chemical Oceanography Data Management Office (BCO-DMO)	2024
10.26008/1912/bco-dmo.919977.1	Data for Artemia fed to corals (Balanophyllia elegans) during a culture experiment conducted to evaluate the relationship between coral diet and tissue nitrogen isotopic ratio from 2019 to 2021	Biological and Chemical Oceanography Data Management Office (BCO-DMO)	2024
10.26008/1912/bco-dmo.881137.1	Size Fractionated Particulate Thorium-234 measurements collected during the 2012-2013 Palmer Field Season	Biological and Chemical Oceanography Data Management Office (BCO-DMO)	2024
10.26008/1912/bco-dmo.881069.1	Phytoplankton nitrate uptake rates collected during the 2012-2013 Palmer Field Season (WAP Carbon export project)	Biological and Chemical Oceanography Data Management Office (BCO-DMO)	2024
10.26008/1912/bco-dmo.881127.1	Particulate organic carbon, nitrogen, and Thorium-234 measurements collected during the 2012-2013 Palmer Field Season (WAP Carbon export project)	Biological and Chemical Oceanography Data Management Office (BCO-DMO)	2024
10.26008/1912/bco-dmo.938004.1	Adult Black Sea Bass (Centropristis striata) winter survival and lipid accumulation under varying diet and temperature conditions from a laboratory mesocosm experiment (Oct 2022 to Apr 2023) with individuals collected in Long Island Sound	Biological and Chemical Oceanography Data Management Office (BCO-DMO)	2024
10.26008/1912/bco-dmo.938012.1	Adult Black Sea Bass (Centropristis striata) winter survival and lipid accumulation in wild-caught fish in Long Island Sound in Sept of 2022 to Apr of 2023	Biological and Chemical Oceanography Data Management Office (BCO-DMO)	2024
10.26008/1912/bco-dmo.937302.1	Concentrations of trace metals and dissolved macronutrients and CTD sensor data from four cruises in the Bermuda Atlantic Time-series Study (BATS) region in March, May, August and November 2019	Biological and Chemical Oceanography Data Management Office (BCO-DMO)	2024
10.26008/1912/bco-dmo.938709.1	Elemental and isoptopic composition of sediment and biomass from the Carpinteria Salt March sampled in 2020 and 2021	Biological and Chemical Oceanography Data Management Office (BCO-DMO)	2024
10.26008/1912/bco-dmo.932236.1	ZooSCAN images of zooplankton collected with MOCNESS tows during six R/V Atlantic Explorer cruises in the northwest Atlantic (Sargasso Sea) from 2021 to 2023	Biological and Chemical Oceanography Data Management Office (BCO-DMO)	2024
10.26008/1912/bco-dmo.938382.1	Sulfur speciation of sediment and biomass from the Carpinteria Salt March sampled in 2020 and 2021	Biological and Chemical Oceanography Data Management Office (BCO-DMO)	2024
10.26008/1912/bco-dmo.931883.1	ZooProcess and Ecotaxa output from ZooSCANs of zooplankton collected with MOCNESS tows during six R/V Atlantic Explorer cruises from 2021 to 2023	Biological and Chemical Oceanography Data Management Office (BCO-DMO)	2024
10.26008/1912/bco-dmo.916046.1	Water temperature, salinity, and optical properties from an Acrobat towed vehicle from bi-weekly grids conducted at Palmer Station, Antarctica in 2020	Biological and Chemical Oceanography Data Management Office (BCO-DMO)	2024
10.26008/1912/bco-dmo.934904.1	Pump CTD profiles from the EMB276 cruise on R/V Elisabeth Mann Borgese in the Baltic Sea from September 20-27, 2021	Biological and Chemical Oceanography Data Management Office (BCO-DMO)	2024
10.26008/1912/bco-dmo.937148.1	Concentrations and stable isotopes of total and deionized water-soluble Fe, Zn, and Cd bulk aerosols and Fe concentrations and stable isotopes of coarse and fine aerosols from Leg 2  of the US GEOTRACES PMT cruise (GP15, RR1815) from Oct to Nov 2018	Biological and Chemical Oceanography Data Management Office (BCO-DMO)	2024
10.26008/1912/bco-dmo.939609.1	Canopy height and epiphyte biomass of artificial seagrass landscapes in June, July, and August 2019 in Back Sound, NC	Biological and Chemical Oceanography Data Management Office (BCO-DMO)	2024
10.26008/1912/bco-dmo.936849.1	Amplicon sequence variants (ASVs) and taxonomy of Pseudo-nitzschia spp. from Narragansett Bay in Rhode Island, USA and the Northeast U.S. Shelf (NES-LTER transect) from 2018-2023	Biological and Chemical Oceanography Data Management Office (BCO-DMO)	2024
10.26008/1912/bco-dmo.936856.1	Pseudo-nitzschia spp. presence-absence and environmental data in Narragansett Bay in Rhode Island, USA and the Northeast U.S. Shelf (NES-LTER transect) from 2018-2023	Biological and Chemical Oceanography Data Management Office (BCO-DMO)	2024
10.26008/1912/bco-dmo.924554.1	Plankton size spectra compiled from projects CCE LTER, HOT, CRD FluZIE, BLOOFINZ-GoM, and SalpPOOP in the California Current Ecosystem, North Pacific subtropical gyre, Costa Rica Dome, Gulf of Mexico, and Southern Ocean subtropical front from 2004-2018	Biological and Chemical Oceanography Data Management Office (BCO-DMO)	2024
10.26008/1912/bco-dmo.939528.1	Oyster shell thickness from study of eastern oysters (Crassostrea virginica) grown in a nursery with or without exposure to chemical cues from blue crabs	Biological and Chemical Oceanography Data Management Office (BCO-DMO)	2024
10.26008/1912/bco-dmo.937120.1	Concentrations and stable isotopes of total and deionized water-soluble Fe, Zn, and Cd bulk aerosols and Fe concentrations and stable isotopes of coarse and fine aerosols from Leg 1 of the US GEOTRACES PMT cruise (GP15, RR1814) from Sept to Oct 2018	Biological and Chemical Oceanography Data Management Office (BCO-DMO)	2024
10.26008/1912/bco-dmo.939332.1	Oyster shell hardness from study of eastern oysters (Crassostrea virginica) grown in a nursery with or without exposure to chemical cues from blue crabs	Biological and Chemical Oceanography Data Management Office (BCO-DMO)	2024
10.26008/1912/bco-dmo.940093.1	Dissolved Fe and Sc concentrations, chlorophyll, nutrients from a scandium incubation experiment during the PUPCYCLE I R/V Oceanus cruise 1905B in the California Current System in 2019	Biological and Chemical Oceanography Data Management Office (BCO-DMO)	2024
10.26008/1912/bco-dmo.940088.1	Particulate metals from a scandium incubation experiment during the PUPCYCLE I R/V Oceanus cruise 1905B in the California Current System in 2019	Biological and Chemical Oceanography Data Management Office (BCO-DMO)	2024
10.26008/1912/bco-dmo.934727.1	Protein identification FASTA file (scaffold-derived metaproteomic proteins) from samples taken during R/V Atlantic Explorer cruise AE1913 from the Sargasso Sea to Northeast US shelf waters in June of 2019	Biological and Chemical Oceanography Data Management Office (BCO-DMO)	2024
10.26008/1912/bco-dmo.934706.1	Scaffold-derived metaproteomic exclusive and total spectral counts associated with proteins from samples taken during R/V Atlantic Explorer cruise AE1913 from the Sargasso Sea to Northeast US shelf waters in June of 2019	Biological and Chemical Oceanography Data Management Office (BCO-DMO)	2024
10.26008/1912/bco-dmo.934718.1	Peptides associated with scaffold-derived metaproteomic proteins from samples taken during R/V Atlantic Explorer cruise AE1913 from the Sargasso Sea to Northeast US shelf waters in June of 2019	Biological and Chemical Oceanography Data Management Office (BCO-DMO)	2024
10.26008/1912/bco-dmo.916429.1	Macronutrients and dissolved and particulate trace metals collected from the R/V Atlantic Explorer cruise AE1913 in the Sargasso Sea in June of 2019	Biological and Chemical Oceanography Data Management Office (BCO-DMO)	2024
10.26008/1912/bco-dmo.926546.1	Pigment concentration data from AUV Clio dives conducted during R/V Atlantic Explorer cruise AE1913 in the Sargasso Sea in June of 2019	Biological and Chemical Oceanography Data Management Office (BCO-DMO)	2024
10.26008/1912/bco-dmo.893182.4	Primary productivity estimates from the incubation of seawater collected at the Bermuda Atlantic Time-series Study (BATS) site from December 1988 through December 2023	Biological and Chemical Oceanography Data Management Office (BCO-DMO)	2024
10.26008/1912/bco-dmo.893521.6	HPLC and fluorometric derived phytoplankton pigment concentrations from seawater collected at the Bermuda Atlantic Time-series Study (BATS) site from October 1988 through December 2023	Biological and Chemical Oceanography Data Management Office (BCO-DMO)	2024
10.26008/1912/bco-dmo.2773.2	Phytoplankton growth, microzooplankton herbivory from R/V Roger Revelle KIWI6, KIWI7, KIWI8, KIWI9 cruises in the Southern Ocean, 1997-1998 (U.S. JGOFS AESOPS project)	Biological and Chemical Oceanography Data Management Office (BCO-DMO)	2024
10.26008/1912/bco-dmo.940112.1	Winter survey data from Lake Erie from Mar 2023 to May 2024	Biological and Chemical Oceanography Data Management Office (BCO-DMO)	2024
10.26008/1912/bco-dmo.943333.1	Specific daily growth of heterotrophic bacteria and grazing mortality on bacteria by microzooplankton from R/V Roger Revelle KIWI6, KIWI7, KIWI8, KIWI9 cruises in the Southern Ocean, 1997-1998 (U.S. JGOFS AESOPS project)	Biological and Chemical Oceanography Data Management Office (BCO-DMO)	2024
10.26008/1912/bco-dmo.933832.1	Lesion frequencies and sizes after fish feces treatment on coral samples collected on the north shore of Mo’orea, French Polynesia, Oct 2020 to Jun 2021	Biological and Chemical Oceanography Data Management Office (BCO-DMO)	2024
10.26008/1912/bco-dmo.935908.1	Bacterial communities and relative abundances of the pathogen Vibrio coralliilyticus in feces of coral reef fish collected on the north shore of Mo’orea, French Polynesia, Oct 2020	Biological and Chemical Oceanography Data Management Office (BCO-DMO)	2024
10.26008/1912/bco-dmo.942686.1	Environmental sensor data from an underwater imaging system (ISIIS-3) collected during R/V Langseth cruise MGL2207 July 20-28 2022 and R/V Sally Ride cruise SR2317 August 10-20 2023 in the Northern California Current	Biological and Chemical Oceanography Data Management Office (BCO-DMO)	2024
10.26008/1912/bco-dmo.939225.1	Dissolved gallium (Ga) from the US GEOTRACES GP17-OCE cruise on R/V Roger Revelle (RR2214) in the South Pacific and Southern Oceans from December 2022 to January 2023	Biological and Chemical Oceanography Data Management Office (BCO-DMO)	2024
10.26008/1912/bco-dmo.894099.4	Determination of carbon, nitrogen, and phosphorus content in sinking particles at the Bermuda Atlantic Time-series Study (BATS) site from December 1988 to December 2023 using a Particle Interceptor Trap System (PITS)	Biological and Chemical Oceanography Data Management Office (BCO-DMO)	2024
10.26008/1912/bco-dmo.917255.5	Discrete bottle samples collected during BATS Validation (BVAL) cruises from April 1991 through June 2023	Biological and Chemical Oceanography Data Management Office (BCO-DMO)	2024
