doi	title	publisher	publicationYear
10.26008/1912/bco-dmo.926534.4	HPLC and fluorometric derived phytoplankton pigment concentrations from seawater collected on BATS Validation cruises from June 1996 to June 2023	Biological and Chemical Oceanography Data Management Office (BCO-DMO)	2024
10.26008/1912/bco-dmo.943015.1	Dissolved trace metals and macronutrients from samples collected using a tow-fish system on R/V Melville MV1405 (IRN-BRU) cruise in the California Current System in July 2014	Biological and Chemical Oceanography Data Management Office (BCO-DMO)	2024
10.26008/1912/bco-dmo.942883.1	Macronutrient concentrations from samples collected using rosette on R/V Melville MV1405 (IRN-BRU) cruise in the California Current System in July 2014	Biological and Chemical Oceanography Data Management Office (BCO-DMO)	2024
10.26008/1912/bco-dmo.940164.1	Total dissolved, dissolved labile, and soluble nickel concentrations determined in water column samples collected on the 2019 Bermuda Atlantic Iron Time-series (BAIT) cruises in the Western Subtropical North Atlantic Gyre	Biological and Chemical Oceanography Data Management Office (BCO-DMO)	2024
10.26008/1912/bco-dmo.942928.1	Dissolved trace metals and macronutrients from samples collected using GoFlo on R/V Melville MV1405 (IRN-BRU) cruise in the California Current System in July 2014	Biological and Chemical Oceanography Data Management Office (BCO-DMO)	2024
10.26008/1912/bco-dmo.923545.1	OOI Global Southern Ocean Array CTD and Discrete Water Sampling Data from Mooring Overturning Cruises in the Southern Pacific Ocean from 2015-2020 (OOI Cruise Data project)	Biological and Chemical Oceanography Data Management Office (BCO-DMO)	2024
10.26008/1912/bco-dmo.944277.1	Dissolved inorganic nutrients from two microcosm incubation experiments conducted on sample water collected from West Bay of the Neuse River Estuary, North Carolina USA in 2021 and 2022	Biological and Chemical Oceanography Data Management Office (BCO-DMO)	2024
10.26008/1912/bco-dmo.942884.1	Biogeochemical and microbial parameters collected during spatial surveys on a coral reef at Mo'orea's North Shore (French Polynesia) in September 2017, May 2019, and April 2022	Biological and Chemical Oceanography Data Management Office (BCO-DMO)	2024
10.26008/1912/bco-dmo.929305.1	Dissolved Macronutrient Concentrations from Depth Profiles and Incubation Experiments from STING I Cruise AE2305 on R/V Atlantic Explorer in the Gulf of Mexico from February to March 2023	Biological and Chemical Oceanography Data Management Office (BCO-DMO)	2024
10.26008/1912/bco-dmo.944892.1	Protist carbon from microscopy samples collected in the Argo Basin of the Eastern Indian Ocean on R/V Roger Revelle cruise RR2202 from Feb to Mar 2022	Biological and Chemical Oceanography Data Management Office (BCO-DMO)	2024
10.26008/1912/bco-dmo.944886.1	Nitrous oxide (N2O) and transient tracer (chlorofluorocarbons, sulfur hexafluoride) concentrations from samples collected on three GO-SHIP cruises in the tropical Pacific Ocean during 2015-2016	Biological and Chemical Oceanography Data Management Office (BCO-DMO)	2024
10.26008/1912/bco-dmo.945375.1	Concentrations of dissolved inorganic macronutrients, chlorophyll a, phaeophytin, PON, and POC measured during phytoplankton shipboard incubation experiments on the FeOA cruise SKQ202209S on R/V Sikuliaq in the NE Pacific from June to July 2022	Biological and Chemical Oceanography Data Management Office (BCO-DMO)	2024
10.26008/1912/bco-dmo.945362.1	Salinity data collected from near-bottom HOBO logger placed in oyster beds in the Delaware Bay Apr 2021 to Nov 2021 (SEGO project)	Biological and Chemical Oceanography Data Management Office (BCO-DMO)	2024
10.26008/1912/bco-dmo.941327.1	Isotopes (d11B, 87Sr/86Sr, d18O, d13C), elemental concentrations (B, Mg, Ca), and carbon content collected from the foraminifera Ammonia parkinsoniana and sediments in Celestun Lagoon, Yucatan, Mexico in June 2009 and May 2015	Biological and Chemical Oceanography Data Management Office (BCO-DMO)	2024
10.26008/1912/bco-dmo.941377.1	Measured and calculated geochemistry values and uncertainty for water samples taken from the water column of Celestun Lagoon, Yucatan, Mexico in May of 2015	Biological and Chemical Oceanography Data Management Office (BCO-DMO)	2024
10.26008/1912/bco-dmo.935630.1	RNAseq data from apparently healthy and Stony Coral Tissue Loss Disease-affected Montastraea cavernosa coral collected from St. Thomas, US Virgin Islands in 2020	Biological and Chemical Oceanography Data Management Office (BCO-DMO)	2024
10.26008/1912/bco-dmo.834967.2	Mesozooplankton wet, dry, carbon and nitrogen biomass and isotope data collected in the oceanic Gulf of Mexico on R/V Nancy Foster cruises NF1704 and NF1802 in May 2017 and May 2018	Biological and Chemical Oceanography Data Management Office (BCO-DMO)	2024
10.26008/1912/bco-dmo.944890.1	Trace metal and organic iron ligand data collected during the PLUME RAIDERS cruise (RR2106) on the R/V Roger Revelle from 18 September – 6 November 2021 along the 16-18ºS section of the Southern East Pacific Rise.	Biological and Chemical Oceanography Data Management Office (BCO-DMO)	2024
10.26008/1912/bco-dmo.925487.2	In situ porewater data from the Cocos Ridge (Eastern Equatorial Pacific) acquired during cruise SR2113 between November - December 2021	Biological and Chemical Oceanography Data Management Office (BCO-DMO)	2024
10.26008/1912/bco-dmo.946504.1	Size-fractionated particulate trace element concentrations determined by ICP-MS from the 2021 North Atlantic EXPORTS cruise (RRS Discovery cruise DY131)	Biological and Chemical Oceanography Data Management Office (BCO-DMO)	2024
10.26008/1912/bco-dmo.946112.1	Dissolved methane (CH₄) concentrations from the U.S. GEOTRACES Arctic cruise (HLY1502; GN01) on USCGC Healy from August to October 2015	Biological and Chemical Oceanography Data Management Office (BCO-DMO)	2024
10.26008/1912/bco-dmo.935476.1	Lab incubations of mussels (Mytilus californianus) examining the influence of periostracum cover and pH on external shell dissolution at Marshall Gulch Beach, CA from August 2021 to March 2022	Biological and Chemical Oceanography Data Management Office (BCO-DMO)	2024
10.7910/dvn/o3ybot	Statistically downscaled and bias corrected CMIP6 models for Continental Chile under scenario SSP5-8.5	Harvard Dataverse	2024
10.5880/gfz.2.6.2023.011	A model of European buildings	GFZ Data Services	2024
10.5880/intermagnet.1991.2020	Intermagnet Reference Data Set (IRDS) 2020 – Definitive Magnetic Observatory Data	GFZ Data Services	2024
10.26275/jjd7-yomj	Anterograde tracing of spinal afferent innervation in flat-mounts of the rat atria	SPARC Portal	2024
10.25326/648	Rainfall composition, Bambey, Senegal	Aeris	2024
10.25326/602	Rainfall composition, Banizoumbou, Niger	Aeris	2024
10.25326/643	Rainfall composition, Dahra, Senegal	Aeris	2024
10.25326/276	Rainfall composition, Lamto, Côte d’Ivoire	Aeris	2024
10.25326/666	Rainfall composition, Zoétélé, Cameroon	Aeris	2024
10.25326/621	PM10 Mineral Analysis, Bambey, Senegal	Aeris	2024
10.5281/zenodo.7089120	LukProt - an animal evolution-centric eukaryotic protein database	Zenodo	2024
10.5281/zenodo.13829058	LukProt - an animal evolution-centric eukaryotic protein database	Zenodo	2024
10.5281/zenodo.10818780	"Dataset for McClelland et al. ""Crop-yield tradeoffs reduce the climate change mitigation potential of soil"""	Zenodo	2024
10.5281/zenodo.10818781	"Dataset for McClelland et al. ""Crop-yield tradeoffs reduce the climate change mitigation potential of soil"""	Zenodo	2024
10.24416/uu01-ezn7cw	WIMBY D2.5 Landscape impact metrics for Switzerland	Utrecht University	2024
10.24416/uu01-v5jpth	"Data accompanying ""Development of an efficient model to calculate subsidence above the Groningen gas field"""	Utrecht University	2024
10.24416/uu01-z58l9k	Hazard and Risk Assessment tool for the Groningen Gas Field, the Netherlands	Utrecht University	2024
10.24416/uu01-0gv5z3	Hazard and Risk Assessment tool for the Groningen Gas Field, the Netherlands	Utrecht University	2024
10.24416/uu01-kvu0sz	PCR-GLOBWB output - 4dHydro working package 5	Utrecht University	2024
10.24416/uu01-0lens1	PCR-GLOBWB experiment 1-0 output - 4dHydro working package 5	Utrecht University	2024
10.24416/uu01-rm2oyu	PCR-GLOBWB experiment 1-0 output - 4dHydro working package 5 [UPDATED]	Utrecht University	2024
10.24416/uu01-8qfvk8	PCR-GLOBWB experiment 1-0 output - 4dHydro working package 5 [UPDATED]	Utrecht University	2024
10.25326/622	PM2.5 Mineral Analysis, Bambey, Senegal	Aeris	2024
10.6096/5006	Inputs for: Towards accurate Ca isotope fractionation at equilibrium between solids and solutions: theoretical schemes inter-comparison, advanced validation and the control of structural cations	Formater	2024
10.1594/pangaea.961168	Spatial layers examining whether a Particularly Sensitive Sea Area can be justified in Bermuda to aid in cetacean conservation	PANGAEA	2024
10.20383/103.0935	An ERA5-based Dataset for Atmospheric River Analysis (EDARA): Multi-decade numerical and graphical catalogues	Federated Research Data Repository / dépôt fédéré de données de recherche	2024
10.16904/envidat.544	SwissRad10 Hourly light availability maps at 10 m resolution over Switzerland	EnviDat	2024
10.17882/102694	Global scale surface micro-plankton dataset collected with Bongo nets and imaged with FlowCam during the Tara Pacific Expedition	SEANOE	2024
10.17882/102697	Global scale surface micro-plankton dataset collected with Deck Net and imaged with FlowCam during the Tara Pacific Expedition	SEANOE	2024
10.17882/102537	Global scale surface meso-plankton and microplastics dataset collected with Manta Net and imaged with ZooScan during the Tara Pacific Expedition	SEANOE	2024
10.17882/102336	Global scale surface meso-plankton dataset collected with High-Speed Net and imaged with ZooScan during the Tara Pacific Expedition	SEANOE	2024
10.1594/pangaea.973169	Distribution of contaminants from the Elbe outflow into the North Sea (German Bight) based on water samples from the MOSES cruise Sternfahrt 10 in 2023	PANGAEA	2024
10.5281/zenodo.14039386	Maps of topsoil (0-30 cm) properties of Tuscany (Italy)	Zenodo	2024
10.23637/rpg5-pgyields19652024-1	Dataset: Park Grass Yields and Fertilizer Treatments 1965-2024	Electronic Rothamsted Archive, Rothamsted Research	2024
10.23637/rbk1-trace2005-01	Dataset: Broadbalk wheat grain micronutrients 1845-2005	Electronic Rothamsted Archive, Rothamsted Research	2024
10.23637/rpg5-fym-01	Dataset: Park Grass Experiment organic manure chemical composition 1856-2017	Electronic Rothamsted Archive, Rothamsted Research	2024
10.23637/rbk1-fym-01	Dataset: Broadbalk Wheat Experiment organic manure chemical composition	Electronic Rothamsted Archive, Rothamsted Research	2024
10.23637/wrn20-sed-01	Dataset: Woburn Erosion Reference Experiment soil erosion and surface runoff data	Electronic Rothamsted Archive, Rothamsted Research	2024
10.23637/wrn20-soil-01	Dataset: Woburn Erosion Reference Experiment plot soil total C and N	Electronic Rothamsted Archive, Rothamsted Research	2024
10.23637/rmstmrain18532023-01	Dataset: Total Monthly Rainfall at Rothamsted March 1853 - December 2023	Electronic Rothamsted Archive, Rothamsted Research	2024
10.23637/wcs10-soil-02	Dataset: Woburn long-term liming experiment soil chemical properties 1962-1996	Electronic Rothamsted Archive, Rothamsted Research	2024
10.23637/wrn20-yield-01	Dataset: Woburn Erosion Reference Experiment crop yields.	Electronic Rothamsted Archive, Rothamsted Research	2024
10.23637/rms-rmaatemp-03	Dataset: Annual Mean Air Temperature at Rothamsted 1878-2023	Electronic Rothamsted Archive, Rothamsted Research	2024
10.17882/89505	MAP-IO (Marion Dusfresne Atmospheric Program - Indian Ocean) flow cytometry	SEANOE	2024
10.6084/m9.figshare.27042447.v1	Additional file 1 of Optimization of ribosome profiling in plants including structural analysis of rRNA fragments	figshare	2024
10.6084/m9.figshare.27012244.v1	Additional file 5 of STUB1-mediated K63-linked ubiquitination of UHRF1 promotes the progression of cholangiocarcinoma by maintaining DNA hypermethylation of PLA2G2A	figshare	2024
10.6084/m9.figshare.26756167	Additional file 2 of SMARCA4 controls state plasticity in small cell lung cancer through regulation of neuroendocrine transcription factors and REST splicing	figshare	2024
10.6084/m9.figshare.26756176	Additional file 5 of SMARCA4 controls state plasticity in small cell lung cancer through regulation of neuroendocrine transcription factors and REST splicing	figshare	2024
10.6084/m9.figshare.26756173	Additional file 4 of SMARCA4 controls state plasticity in small cell lung cancer through regulation of neuroendocrine transcription factors and REST splicing	figshare	2024
10.6084/m9.figshare.26756170.v1	Additional file 3 of SMARCA4 controls state plasticity in small cell lung cancer through regulation of neuroendocrine transcription factors and REST splicing	figshare	2024
10.6084/m9.figshare.26756167.v1	Additional file 2 of SMARCA4 controls state plasticity in small cell lung cancer through regulation of neuroendocrine transcription factors and REST splicing	figshare	2024
10.6084/m9.figshare.26756173.v1	Additional file 4 of SMARCA4 controls state plasticity in small cell lung cancer through regulation of neuroendocrine transcription factors and REST splicing	figshare	2024
10.6084/m9.figshare.26756176.v1	Additional file 5 of SMARCA4 controls state plasticity in small cell lung cancer through regulation of neuroendocrine transcription factors and REST splicing	figshare	2024
10.6084/m9.figshare.26756170	Additional file 3 of SMARCA4 controls state plasticity in small cell lung cancer through regulation of neuroendocrine transcription factors and REST splicing	figshare	2024
10.6084/m9.figshare.26754793.v1	Additional file 1 of Characterization of DREB family genes in Lotus japonicus and LjDREB2B overexpression increased drought tolerance in transgenic Arabidopsis	figshare	2024
10.6084/m9.figshare.26754793	Additional file 1 of Characterization of DREB family genes in Lotus japonicus and LjDREB2B overexpression increased drought tolerance in transgenic Arabidopsis	figshare	2024
10.6084/m9.figshare.26195816	Additional file 1 of scMultiome analysis identifies a single caudal hindbrain compartment in the developing zebrafish nervous system	figshare	2024
10.6084/m9.figshare.26195816.v1	Additional file 1 of scMultiome analysis identifies a single caudal hindbrain compartment in the developing zebrafish nervous system	figshare	2024
10.16904/envidat.529	ERRA -- an R script for Ensemble Rainfall-Runoff Analysis	EnviDat	2024
10.17190/amf/2331385	AmeriFlux US-YK2 Yukon-Kuskokwim Delta, Izaviknek-Kingaglia uplands, Unburned	Woodwell Climate Research Center	2024
10.17190/amf/2315766	AmeriFlux CA-EM1 Newdale Manitoba	Institute for Wetland and Waterfowl Research, Ducks Unlimited Canada	2024
10.34847/nkl.9100h0ud	Projet TariMa. Transcription HTR : BnF Manuscrits Arabe 4617 (xml-alto)	NAKALA - https://nakala.fr (Huma-Num - CNRS)	2024
10.34847/nkl.01a5g68w	Projet TariMa. Transcription HTR : BnF Manuscrits Arabe 6880 (xml-alto)	NAKALA - https://nakala.fr (Huma-Num - CNRS)	2024
10.34847/nkl.88cayz27	Projet TariMa. Transcription HTR : BnF Manuscrits Arabe 7214 (xml-alto)	NAKALA - https://nakala.fr (Huma-Num - CNRS)	2024
10.34847/nkl.293d5aww	Projet TariMa. Transcription HTR : BnF Manuscrits Arabe 2297 (xml-alto)	NAKALA - https://nakala.fr (Huma-Num - CNRS)	2024
10.34847/nkl.349c8m3h	Projet TariMa. Transcription HTR : BnF Manuscrits Arabe 7024 (xml-alto)	NAKALA - https://nakala.fr (Huma-Num - CNRS)	2024
10.34847/nkl.1e01n729	Projet TariMa. Transcription HTR : BnF Manuscrits Arabe 7021 (xml-alto)	NAKALA - https://nakala.fr (Huma-Num - CNRS)	2024
10.34847/nkl.bc1aj755	Projet TariMa. Transcription HTR : BnF Manuscrits Arabe 6898 (xml-alto)	NAKALA - https://nakala.fr (Huma-Num - CNRS)	2024
10.34847/nkl.dae480lp	Projet TariMa. Transcription HTR : MMSH MS 056 (xml-alto)	NAKALA - https://nakala.fr (Huma-Num - CNRS)	2024
10.34847/nkl.25b4o345	Projet TariMa. Transcription HTR : MMSH MS 051.2 (xml-alto)	NAKALA - https://nakala.fr (Huma-Num - CNRS)	2024
10.34847/nkl.b773829u	Projet TariMa. Transcription HTR : MMSH MS 011 (xml-alto)	NAKALA - https://nakala.fr (Huma-Num - CNRS)	2024
10.34847/nkl.013b388w	Projet TariMa. Transcription HTR : MMSH MS 051.1 (xml-alto)	NAKALA - https://nakala.fr (Huma-Num - CNRS)	2024
10.34847/nkl.8d33h90x	Projet TariMa. Transcription HTR : MMSH MS 050 (xml-alto)	NAKALA - https://nakala.fr (Huma-Num - CNRS)	2024
10.34847/nkl.0fc6k4e1	Projet TariMa. Transcription OCR : BULAC.RES.MON.4.3423 (xml-alto)	NAKALA - https://nakala.fr (Huma-Num - CNRS)	2024
10.34847/nkl.3edd0889	Projet TariMa. Transcription OCR : BULAC.RES.MON.8.4352 (xml-alto)	NAKALA - https://nakala.fr (Huma-Num - CNRS)	2024
10.34847/nkl.ef8dychy	Projet TariMa. Transcription OCR : BULAC.RES.MON.4.3424 (xml-alto)	NAKALA - https://nakala.fr (Huma-Num - CNRS)	2024
10.34847/nkl.cf3843x2	Projet TariMa. Transcription OCR : BULAC.RES.MON.8.4734 (xml-alto)	NAKALA - https://nakala.fr (Huma-Num - CNRS)	2024
10.34847/nkl.bd8b8to9	Projet TariMa. Transcription OCR : BULAC BIULO MEL.8.881.24 (xml-alto)	NAKALA - https://nakala.fr (Huma-Num - CNRS)	2024
10.34847/nkl.aab52c76	Projet TariMa. Transcription OCR : BULAC BIULO.MEL.8.881.31 (xml-alto)	NAKALA - https://nakala.fr (Huma-Num - CNRS)	2024
10.34847/nkl.4bdaw9d7	Projet TariMa. Transcription OCR : BULAC RES MON 8 8967 (xml-alto)	NAKALA - https://nakala.fr (Huma-Num - CNRS)	2024
10.34847/nkl.edc44728	Projet TariMa. Transcription OCR : BULAC BIULO AF.II.177 (xml-alto)	NAKALA - https://nakala.fr (Huma-Num - CNRS)	2024
10.34847/nkl.ff0cos4x	Projet TariMa. Transcription HTR : BULAC RES MON 8 5560 (xml-alto)	NAKALA - https://nakala.fr (Huma-Num - CNRS)	2024
10.34847/nkl.1f1b0bks	Projet TariMa. Transcription HTR : BULAC RES MON 8 5561 (xml-alto)	NAKALA - https://nakala.fr (Huma-Num - CNRS)	2024
10.34847/nkl.2fffublt	Projet TariMa. Transcription HTR : BULAC RES MON 8 7199 (xml-alto)	NAKALA - https://nakala.fr (Huma-Num - CNRS)	2024
10.34847/nkl.fcdfpmgr	Projet TariMa. Transcription HTR : BULAC RES MON 8 5336 (xml-alto)	NAKALA - https://nakala.fr (Huma-Num - CNRS)	2024
10.34847/nkl.edefq82x	Projet TariMa. Transcription HTR : BULAC RES MON 8 6212 (xml-alto)	NAKALA - https://nakala.fr (Huma-Num - CNRS)	2024
10.34847/nkl.afa104o6	Projet TariMa. Transcription HTR : BULAC RES MON 8 3955 (xml-alto)	NAKALA - https://nakala.fr (Huma-Num - CNRS)	2024
10.34847/nkl.c8fap022	Projet TariMa. Transcription HTR : BULAC MS.ARA.417 (xml-alto)	NAKALA - https://nakala.fr (Huma-Num - CNRS)	2024
10.34847/nkl.d7562n3k	Projet TariMa. Transcription HTR : BULAC MS.ARA.794 (xml-alto)	NAKALA - https://nakala.fr (Huma-Num - CNRS)	2024
10.34847/nkl.52ces2uk	[الكتاب الباشي]	NAKALA - https://nakala.fr (Huma-Num - CNRS)	2024
10.34847/nkl.f6aaxz72	Projet TariMa. Transcription HTR : BULAC MS.ARA.453 (xml-alto)	NAKALA - https://nakala.fr (Huma-Num - CNRS)	2024
10.34847/nkl.2cbe86q3	Projet TariMa. Transcription HTR : BULAC MS.ARA.452 (xml-alto)	NAKALA - https://nakala.fr (Huma-Num - CNRS)	2024
10.34847/nkl.fd2a5os6	Projet TariMa. Transcription HTR : BULAC MS.ARA.436c (xml-alto)	NAKALA - https://nakala.fr (Huma-Num - CNRS)	2024
10.34847/nkl.42ef2793	Projet TariMa. Transcription HTR : BULAC MS.ARA.427 (xml-alto)	NAKALA - https://nakala.fr (Huma-Num - CNRS)	2024
10.34847/nkl.57eay314	Projet TariMa. Transcription HTR : BULAC MS.ARA.410 (xml-alto)	NAKALA - https://nakala.fr (Huma-Num - CNRS)	2024
10.34847/nkl.c89fo59q	Projet TariMa. Transcription OCR : BULAC RES.MON.4.3416 (xml-alto)	NAKALA - https://nakala.fr (Huma-Num - CNRS)	2024
10.1594/pangaea.965341	Accumulation stake readings in western Dronning Maud Land (Antarctica) along the Neumayer-Kottas-Kohnen traverse 2003 to 2004	PANGAEA	2024
10.1594/pangaea.965339	Accumulation stake readings in western Dronning Maud Land (Antarctica) along the Neumayer-Kottas-Kohnen traverse 1997 to 1998	PANGAEA	2024
10.1594/pangaea.965340	Accumulation stake readings in western Dronning Maud Land (Antarctica) along the Neumayer-Kottas-Kohnen traverse 1996 to1997	PANGAEA	2024
10.1594/pangaea.965343	Accumulation stake readings in western Dronning Maud Land (Antarctica) along the Neumayer-Kottas-Kohnen traverse 2002 to 2003	PANGAEA	2024
10.1594/pangaea.965342	Accumulation stake readings in western Dronning Maud Land (Antarctica) along the Neumayer-Kottas-Kohnen traverse 1998 to 1999	PANGAEA	2024
10.1594/pangaea.965346	Accumulation stake readings in western Dronning Maud Land (Antarctica) along the Neumayer-Kottas-Kohnen traverse 1999 to 2000	PANGAEA	2024
10.1594/pangaea.965345	Accumulation stake readings in western Dronning Maud Land (Antarctica) along the Neumayer-Kottas-Kohnen traverse 2001 to 2002	PANGAEA	2024
10.1594/pangaea.965344	Accumulation stake readings in western Dronning Maud Land (Antarctica) along the Neumayer-Kottas-Kohnen traverse 2000 to 2001	PANGAEA	2024
10.1594/pangaea.965333	Accumulation stake readings in western Dronning Maud Land (Antarctica) along the Neumayer-Kottas-Kohnen traverse 2005 to 2006	PANGAEA	2024
10.1594/pangaea.965337	Accumulation stake readings in western Dronning Maud Land (Antarctica) along the Neumayer-Kottas-Kohnen traverse 1995 to 1996	PANGAEA	2024
10.1594/pangaea.965338	Accumulation stake readings in western Dronning Maud Land (Antarctica) along the Neumayer-Kottas-Kohnen traverse 2004 to 2005	PANGAEA	2024
10.5281/zenodo.17444371	Analisis critico de los resultados de búsqueda de Google: estudio de la influencia del algoritmo en la percepción de la realidad	Zenodo	2024
10.5281/zenodo.17444370	Analisis critico de los resultados de búsqueda de Google: estudio de la influencia del algoritmo en la percepción de la realidad	Zenodo	2024
10.17882/97285	Microseismicity catalogs for Lucky Strike volcano summit region, Mid-Atlantic Ridge from the EMSO-Azores observatory, 2007-2019	SEANOE	2024
10.17882/45980	BILLION observatory data	SEANOE	2024
10.17882/45461	MEOP-CTD in-situ data collection: a Southern ocean Marine-mammals calibrated sea water temperatures and salinities observations	SEANOE	2024
10.6084/m9.figshare.24465306.v1	Additional file 2 of Endometrial cancer (EC) derived G3BP1 overexpression and mutant promote EC tumorigenesis and metastasis via SPOP/ERα axis	figshare	2024
10.6084/m9.figshare.24465306	Additional file 2 of Endometrial cancer (EC) derived G3BP1 overexpression and mutant promote EC tumorigenesis and metastasis via SPOP/ERα axis	figshare	2024
10.25397/eur.26147659.v1	Regional socialization and disarmament preferences: Explaining state positions on the nuclear ban treaty	Erasmus University Rotterdam (EUR)	2024
10.25397/eur.26147659	Regional socialization and disarmament preferences: Explaining state positions on the nuclear ban treaty	Erasmus University Rotterdam (EUR)	2024
10.25397/eur.18257165	Peer relations buffer the negative effects of forced online education in medical students	Erasmus University Rotterdam (EUR)	2024
10.1594/pangaea.974317	Raw physical oceanography and ocean current velocity data from mooring Y5-1 on the Yermak Plateau, Arctic Ocean, July 2022 – June 2023	PANGAEA	2024
10.1594/pangaea.974316	Raw physical oceanography, bio-optical and biogeochemical data from mooring Y4-1 on the Yermak Plateau, Arctic Ocean, July 2022 – June 2023	PANGAEA	2024
10.1594/pangaea.974312	Raw physical oceanography and profiling winch data from mooring Y2-1 on the Yermak Plateau, Arctic Ocean, July 2022 – June 2023	PANGAEA	2024
10.25826/data20240202-162836-0	Dataset for the Comprehensive Characterization of Plant-Based Drinks: Vitamins and Selected Secondary Plant Metabolites	Bundesbehörden und Einrichtungen im Geschäftsbereich des Bundesministeriums für Ernährung und Landwirtschaft (BMEL)	2024
10.25826/data20240202-110116-0	Dataset for the Comprehensive Characterization of Plant-Based Drinks: Macronutrients, Amino Acids and Fatty Acids	Bundesbehörden und Einrichtungen im Geschäftsbereich des Bundesministeriums für Ernährung und Landwirtschaft (BMEL)	2024
10.25826/data20240228-093140-0	Dataset for the Comprehensive Characterization of Plant-Based Drinks: Various Minerals, Trace Elements and Heavy Metals	Bundesbehörden und Einrichtungen im Geschäftsbereich des Bundesministeriums für Ernährung und Landwirtschaft (BMEL)	2024
10.25826/data20240621-100704-0	Data set for the nutrient characterization of selected milling products from rye, spelt and wheat in Germany	OpenAgrar Repository	2024
10.5281/zenodo.10984229	Supplementary Data for: Worldwide consequences of a mid-Holocene cold event in the Nordic Seas	Zenodo	2024
10.5281/zenodo.8321171	Supplementary Data for: Worldwide consequences of a mid-Holocene cold event in the Nordic Seas	Zenodo	2024
10.5281/zenodo.13736581	Investigating the Auditory Selective Attention Switch using Matrix Sentences in VR	Zenodo	2024
10.5281/zenodo.13736582	Investigating the Auditory Selective Attention Switch using Matrix Sentences in VR	Zenodo	2024
10.5281/zenodo.13380476	Investigating the Impact of Visual Stimuli on the Auditory Selective Attention in a VR Classroom	Zenodo	2024
10.1594/pangaea.962929	Sub-decadal diatom oxygen isotope record of the last 220 years (2015-1790CE) of sediment short core EN18232-1 from Lake Khamra, SW Yakutia, Siberia, Russia	PANGAEA	2024
10.1594/pangaea.968713	Benthic megafauna abundance from Norfolk and Baltimore Canyons chemosynthetic environments	PANGAEA	2024
10.1594/pangaea.964771	Survival and metabolomics of Mya arenaria and Mya truncata after 12 days in experimental heatwave conditions, files and related R scripts	PANGAEA	2024
